id,userid,sex,adress,age,text,stance
951,d9e421ffe19d84bc44a04b560133c0b52b7a1a61,女,广东,其他,央视中秋晚会上脸部变化最大的感觉是1983年出生的中国内地男高音歌手、歌剧演员王凯。非常喜欢他的声音。在声入人心歌唱比赛时很关注他。因此在昨晚的中秋晚会上看到他的时候觉得他的两腮下去了，显得头小了，整个脸型似乎有变化，眼睛似乎也不对了。是整容了还是化妆的效果？周深的鼻子以前没觉得那么大，鼻翼以前有这么宽吗？看看韩磊，一成不变的大眼袋和脸部岁月留下的痕迹，丝毫没有影响到他独特有魅力的浑厚歌声，棒极了。岁月蹉跎，人才辈出，影、视、歌坛后起之秀如雨后春笋一样冒出来，整出来的年轻又如何比得过真正的小鲜肉？还是实力说话。除非模样实在是不够养眼影响了在领域里的发展。不过现在普通人整容的也不少。时代不一样了。人们的选择更多了。,none
832,6518ab8f83fd56043c329a14f9d3119c3e9eaaf0,男,广东,中青年,"发布了头条文章：《暑期学生忙“蜕变”,，微整容、双眼皮手术都排起了长队。》,暑期最近面诊的学生越来越多，有爸爸带着来的，也有妈妈带着来的。这也说明一个问题，长辈们都意识到了颜值的重要性，她们不是反对整形，只是反对不安全的整形。怎么才能放心呢？找到一家正规机构跟一个好医生！,暑期学生忙“蜕变”,，微整容、双眼皮手术都排起了长队。",none
6906,1c52b3d89d38ec291f443b34d5c4f3a6fe280938,女,山西,中青年,这是第几次整容了,none
1171,df5c4259c43eb01c22baba05d6c9043a742a99ac,女,北京,青年,"咋办。,双眼皮已经割了",none
674,74dc55fcfa1283373ab4728b4734bbac8f884265,女,广东,中青年,其实我这个人运气一直都很好的，我算是资质平平的人，但我只要努力，重点中学重点班重点大学就考上了，但是171819我可以说非常倒霉，包括一直在医药行业萎靡不振找不到出路，但是2020年七月吧，整容加拆牙套以后整个人运气是真的开了挂，找到现在的男朋友，有现在的工作，做其他什么副业也是风生水起，我还记得大学那时候长了满脸痘，我还想难道我这辈子都这样吗，谁知道一夜之间痘痘全部消失了痘印也没有，只吃了镇静药和温胆汤，这辈子真的全靠好运气,favor
2740,7e6d47ab6f1344548b6096f5cae9d84ccd1b55c1,男,四川,中青年,真正好看的人，别人说你胖你丑你满脸坑整容失败，他也许只会笑笑就过去了，因为那些明显的不是事实，不是事实的自然不会伤害到人。只有确实胖坑丑败的人，才会急得生气吧,none
732,3a1baf9fe887c59e596d5dc3ac0de18317f8777a,女,上海,青年,太想整容了今晚也一个人哞哞的哭了emo ,favor
2438,ccc6f5ca29cb55eb71c02c78f7a4822c2739cd7e,女,海外,其他,我才发现我女的那几个part都不大好推镜头😾还有一些人，我女在你们眼中变好看了就是整容了吗😾,against
1120,b9d9d96e9d21a262b12bf82d78bb7f08815d5c8e,女,浙江,其他,"我觉得窝巢粉丝这么几年一点都没进步,都什么年代了,整个容怎么了,是伤害你父母了还是犯法了,我觉得演员本本分分演戏,老老实实做人就行,整不整容关你屁事,花你家钱了,整个弹幕都是脸都认不出来了这种一听就很假的话,到底是一些土鳖没钱了解微整容行业,明明很好看,弹幕都是僵僵僵,丑人你们有时间说别人不如多花时间让自己长知识变漂亮吧,杭州·采荷",favor
1322,5b6bc808c17557d46201a44add150576a6c2ad89,女,海外,其他,我发现好多人整容都是无效整容 整了一大堆也不好看 越整越奇怪 广州·珠江新城 ,against
1001,2b377aed51c0d4e069ee3de7bce571661959523a,女,其他,青年,只要美就都是美女,favor
2023,e4a76efb9231a8ec0aa8ee5e073a2b1933087977,女,山东,中青年,刚刚什么时候能分享一下双眼皮的功课啊,favor
1564,f2af4767e13d489756e88afeccd6b658010a1d21,男,其他,其他,有时候真的看不懂这b互联网、、一群人说着拒绝容貌羞辱  结果追着骂某个明星丑的也是这群人   明星整容了要说不真实，不整容你又要嫌人丑不能当演员不能当爱豆   咋了合着明星就活该被容貌羞辱？ 好话坏话都让这群b网友说完了、、 ,favor
840,4ebb238faf9ca1fbdc7412aa3e3d7a7ba75f48f6,女,浙江,青年,我不理解……在和我妈讨论整容医美项目，我妈真的一到整容医院就打电话给我让我拍照给医生看,against
631,f6fc66a821d88e0aeea132f6eabbf62d6ccb7a4b,女,海外,青年,"救命,隋彦旭太好看了,我的新整容模版又有了",favor
2008,92bbb263a955ffc2dd3451b886adec698333e685,男,北京,中青年,要和真的美人比,none
4664,a0249ea74dd2a020ecc13cedf6590ae4c1e624e6,女,湖南,其他,最美好的事是我赚够了一生用的钱，然后每天过着舒服的日子，读书，画画，写着小说和微博。写尽这个世界真实的男男女女，把他们刻画得入木三分。他们都是我熟悉的人，都是超写实的小说。啊，这比天天沙龙、整容，攀比，吃吃喝喝有趣多了。我也不在乎这些东西能不能卖钱，反正想写什么就写什么，想穿什么衣服就做什么衣服。,against
3239,ea19408b35f3ca958d74df0bbc18a68838f917f9,女,北京,其他,"原来如此,联想到我从小就是精神小妹的同学去整容",none
1372,05255fb1aa7db6219c0016f0918cdd6e7b248150,女,广东,中青年,"他的演技，他的相貌，不管怎么样，他都不比别人差，主要的是他爱努力，他努力了。就算她整容了，也是上帝整的，就算她整容了，我们也爱她，整了又怎样，他们喜欢的明星就没有整过吗？,你们是怎么喜欢上鞠婧祎的？",favor
351,f327e035eb9e29b7647966c165b7f5178b763db1,女,海外,青年,几年前古早网红们聚会，总被嘲长得都一样，同脸同鼻同医生。后来发现有的人做了好几年功课，常年各地飞找医生做手术，也花了几十万，仍然整不出网红脸。所以有什么脸嘲网红都长一样。你整了这么多次，不也没整出来嘛。,against
1941,335e1ba2394f730067d5c6cb8e1295cea8c0a8a7,女,海外,其他,"ze的脸就是我的整容模版,她每次的口红色号都是我的爱",favor
465,f8a4fdd95b9daa0d809e24e5eca5a6bc542633a7,女,广东,其他,对，人无完人，别人问我为什么喜欢她，说她不好，我就说因为我是颜粉啊。其实我不是，只是不想去说那么多。毕竟那些人又不了解她。,favor
3414,427818793e9fd25a312adef53ee805ca8abc745f,男,北京,其他,"这种一般上来就问,想不想做副业,美容行业了解一下……这种",none
1888,3bc5e64f59b645e6ec8a7a8e4e0519d8a7701ab0,女,江苏,中青年,明星艺人为了能够让自己好看一些，通常都会去做一些整容，垫一下鼻梁、开眼角、做双眼皮等等，这样的情况在娱乐圈可以说是屡见不鲜！但是不知道观众们听没听说过，导演要求演员去整容呢？因为角色的长相跟影视剧中的形象严重不符，于是被导演要求去做整容手术。我想一般演员在听到这个消息之后，一般就会望而却步，拒绝这部戏的拍摄！但是对于一些小演员来说，能接一部戏并不容易，如果错过了这一部，还不知道要等多长时间，因此一定会把握机会。如今有一档访谈节目正在热播，这档节目叫《我们的小酒馆》，经常会请来一些嘉宾做客，聊一聊自己曾经的经历，最近请来了一位叫魏紫伊的演员。这位演员聊了聊自己曾经的经历，表示之前一个台湾演员让自己出演电影的女二号，但是因为演员的阴沟鼻子非常夸张，被导演要求磨掉。导演表示你的鼻子太厉害了，你的角色在这部戏中是一个温柔的学姐，非常校园的那种，你把鹰钩鼻子给磨平吧，磨平就让你出演这部剧的女二号。女演员听从了导演的建议，并且双方签订了合同，对方给了5000元的定金！之后演员专门去了一趟韩国，将自己的鼻子给磨平了。但是整完之后这个戏也没有上，角色也没有了！女演员对这件事相当的后悔，因为现在很多观众都拿他整过容说事，对演员的事业造成了影响！其实有一些小导演的权利反而比一些大导演要大一些，这些小导演拍摄的一般是网络大电影，请不来一些知名演员，会去请一些网红或者小演员。一些网红或者小演员为了进军娱乐圈或成为明星大咖，一般会争着抢着去报名出演！为了获得机会，他们往往会比成年演员更舍得牺牲自己，这位演员的遭遇就是一个非常好的例子！毕竟错过了这次机会之后，下次出演电影还不知道是什么时候。与其错过机会，还不如好好地搏一搏，说不定凭借这部电影，自己就能一炮而红。而一些小导演也是把握了演员的这种心理，有时候会提出一些比较过分的要求！而演员权衡利弊之后，一般都会答应，按照导演的要求去做！我想如果魏紫伊是成名已久的明星大咖，她一定不会答应导演，将自己祖传的“鹰钩鼻”给磨平。如今戏没了，但是她的“鹰钩鼻”却回不来了，这对她的影响是一生的，但如今的这一切算是白做了。演员在面对不合理要求的时候，也要权衡一下利弊，这样做到底值不值得？会不会对未来自己造成影响？一定要想清楚再做出自己的决定！否则就会像这位演员一样，赔了夫人又折兵，整了容也演不了角色，白白牺牲了自己的“鹰钩鼻”！对此你有什么想说的？欢迎在评论区留言讨论。,against
223,d8f80ff069900cf8039935f9b6f61ec5c1e36203,女,四川,其他,整容好可怕我以后绝对不整容，我要是整容我就biss，微整容也不行,against
1799,b4fc5e396f9a962d79252f65e632c0cc0c9fc713,女,北京,其他,真不知道你这个丑逼整容怪有啥脸子好甩的大老远两个大美女跑过来给你脸了一拳给你假鼻子打飞 ,against
9852,5e07ab462b4f123cdcec385538938a5c6c32c257,男,上海,其他,",凯西·戴维斯提出：整容既是问题也是解答，既是压迫也是解放。她虽然把美容手术当作西方美貌文化最恶质的展现来探讨，却不把整形的女人贬低成”文化冤大头“。她认为，美容手术归根究底是关于认同的问题；与其说这些女人追求美丽，不如说她们渴望正常，”想做正常女人“。整容可能是女性的一个策略——帮助她成为体现的主体。——沈奕斐《透过性别看世界》",favor
2110,8edd980b061af85917e4ee2f9ef7e993f9bddbd1,女,江苏,其他,偶遇十多年不见的死党舅舅，他在我面前晃悠了半天，说：“孩子，你是不是整容了？”那一刻，我不知道是该哭还是该笑！,none
1853,327411faaa6359b46447563112b521733572e28e,女,其他,其他,女生也喜欢看美女，我喜欢脸型是圆中带方的脸型，觉得这样的脸型看起来最舒服不必整容，各自欣赏的美不同～重要的是：老了以后在自己脸上会看到父母的影子,against
3105,07171054728658f5e05fb28164932d1340f3a2b9,女,海外,青年,所以整容圈大部分女的把我拉黑了。//@Zh的果园吧:网红圈的审美是真的病态，明显的雌和雄的差距，她们的一举一动都是为了吸引男人，让男人来征服，雄竞女更有一种作为人的体面，让男人忘而怯之，把你当个社会人尊重。不得不承认中国男性骨子里的那种大男子主义，他们喜欢女人被征服和听话的感觉。,against
9999,0f26f2ad81ab04329e1095088f89cab99d3f3bdf,男,湖南,中青年,周淑怡在有人给她拍视频的时候喜欢说“美颜给我拉满”，宝剑嫂说“男友不接受女友的素颜，就休想拥有女友的化妆美颜”，野蛮女人似乎把美颜和化妆这种骗人的技术当成一种理所当然的存在，不过野蛮人本来就喜欢自己骗子和欺骗别人，整容、美颜、化妆在野蛮人的社会大有市场本来就是一种必然，，，,favor
2021,eb09b57a87fa60d9568d77fca9a44f3ec371608d,女,北京,中青年,"甜甜说郭军的轮廓顶流,那我也算是放心多了,轮廓手术比鼻子还要家里人这关不知道咋过,那些要做整容的人,总是找医院,我觉得医生比医院重要,不要首选医院",favor
4690,ca0298a563a0352c9e7d4bcdbe169643f5054fdb,女,北京,其他,有些网友对女性的恶意溢出屏幕了。女网红怎么了？整容怎么了？明星整容少了？这是哪个朝代对女性的要求啊，动不动就荡妇羞辱，说不是个好东西，你也许还没人家网红有本事。对男明星就是没被抓紧去坐牢就行了。这双标可把我恶心坏了。,favor
498,f6fcfe00d819f36d0463c07267e8bd905567bf69,男,其他,其他,"推荐一个账号→网页链接,会发各种明星的原图，看完能大大缓解容貌焦虑。明星请一整个团队花那么多钱整容医美健身，拍出来的照片依然看得见很粗的毛孔很深的皱纹，皮肤也并不白皙……我一个普通人，释怀了。",against
1774,5108cb4cc0814bade27c26d8f25cc1761f6c8a38,女,北京,其他,"选整容模版的时候我有个执念，就是不能选很漂亮但是命运比较坎坷的美女当模版。这类美女其实有很多,女明星也好,女网红也好具体不能说是谁,但是大众都叫得出名字的惊为天人的美女也有很多比较坎坷的，有的事业坎坷有的感情坎坷，如果很在乎哪个方面，就尽量不要选那种你觉得很美但是她在你在乎的方面运势很不好的艺人当模版。建议选运势走的好的，并且和自己原生脸有相似之处的。比如我做轮廓功课的时候只考虑小尖脸美女，孝敏啊、洪智允之类的。圆脸美女再好看我也做不出来那个效果，所以不会考虑。我觉得脸上的运势非常重要，能提运的就尽量提运，非常漂亮但是坎坷也不会很快乐的。",favor
7285,70565005f87ae71b48fdc1c7e3f1ff347a29ca4d,女,海外,青年,"找到了整容方向,把下頜肉拉上去,能看起來瘦二十斤",none
1435,b10366a371da54f346f2b36fbbb3a49fc7cf07f2,女,四川,中青年,准备整容重新做人了[开学季] ,favor
1651,722709f88ffbe66f856fdd5358f83ca9525692af,女,广东,中青年,"粉丝反馈：骨性龅牙选对正畸医生，堪比正颌！现在我的龅牙已经收进去了，连我妈都怀疑我是不是跑去整容了！,苏阿姨聊口腔正畸的微博视频",favor
1046,51a55e337a22b58b6290cf268c17d58c2d864bb3,女,广西,中青年,只有我觉得明星整容、植发变好看变帅，这种行为跟化妆p图没啥区别吗？反正都是为了业务嘛，总是要养眼的，在不影响别人的情况下自己变好看有啥问题…,against
1221,ce8f35922a53c4f4bf4e79d0120c64aae3f21700,男,辽宁,中青年,整容毁一生,against
927,12878cc160a41e1db8f7934476010451a290e74b,女,广东,老年,长得丑的女孩也可以从其他方面弥补自己的缺陷，比如说你的性格可以变得活泼开朗，嗯，有吸引力你可以学会做饭呀，插花呀，蜂蜜呀，这些东西都可以提升你的吸引力，如果实在觉得没有办法，你也可以去到医院去做一个微整容，是让他休整一下，这样会有可能以后会有更多的人被你吸引吧。  ,favor
1006,1220087e6c7eb2aca31c3bf09171b85d8ff90ced,女,内蒙古,中青年,"想整容做个欧式大眼皮,顺便磨个骨值个发",favor
1610,a44fa9500f1b837f34aa8fb4b9af18998a609a9f,女,福建,青年,不是你容颜易老，而是抗衰做的太少～眼里有光的女人，星辰大海都比不上[爱心]🇨🇭瑞士微科不是整容，而是最高级的医疗保养 Alice-小敏的微博视频 ,favor
46,19bed8799d4d2e6a11e6c6797d77780f80b8f128,女,北京,其他,说一说北京做鼻子近期整容医生范飞做鼻再造真的一绝，很厉害的医生，审美一般李劲良风格比较自然，鼻子基础再造很厉害，直鼻案例多刘彦军审美还可以，可以解决肋软骨的弯曲问题 #整形# 做的好不好？多少钱？技术怎么样？可以问我或评论自助查 ,favor
62,7b6c463f2dfecea974abd96d711b178165b3b8be,女,其他,其他,#仙畜有别# 天然帅哥好浪漫 吊打整容怪,against
1004,c27d61f3ed07aefa02b9b13c60aff4cd59f09f1a,女,山东,中青年,有些男明星真是丑得千奇百怪。女明星可以说get不到，可以说普通，但是没有丑的，（除了整容整残了，整残之前也是美女），哪怕整过也行，比如好几千年那个，不辣眼睛就行。男明星咋这样，那个脸型估计整也整不好。,favor
808,daa23098fc0f8189f598e6de2931d6124955e9c2,男,陕西,中青年,整牙真的要多面诊几个医院，有些只能改善面型，有些只能改善咬合,favor
1027,2c82bc371facb465cc97c4b67fbe023b9a973641,女,其他,其他,"我说鬼子粉速来我这里把你整容过度还崩了的哥哥小卡带走,250一张😆💖我们大back只能10块一张,你们大桃浦250一张不过分吧,拿了💰记得jz给哥哥再整整,争取回到从前[鮮花]",against
4576,a9b477638bc5f93f84aad01c75cdcaefd4c3c71a,女,其他,其他,回复@德州家康_:不好意思，本粉丝天天看着他的会不比你这个路人清楚？王俊凯一直都长这样，又说不出哪里整了就能张口造谣了？他这张脸是多想不开才要去整容啊，整容等于毁容了，丑货才需要整容。,against
644,65d5a3e14d5c92c69e85895dcadd26decb16a400,女,广东,其他,有钱一定整容 ,favor
800,59d7dc2f634a16683bd464cf35f06567877d2e0f,女,云南,中青年,家里的身边的 有点身份的都没有整容的,against
964,0f04edac5eeedb15f24cd98d0cc4bb638140e211,男,其他,中青年,你其实长得挺好看的，五官是比较温婉可人的类型，不必非要是追求锥子脸窜天鼻才好看,against
632,38908e2b537fd6dd20960e4456cb796b519c7895,女,浙江,其他,非常难受的是为什么明明帅气又清爽的男明星一定要整容啊整的一点个人特点都没有了哼,against
9594,19b5869cc50504e489914c455de3e6688784f85e,女,海外,其他,看完最新一期换乘恋爱，感叹宝泫和coco真的是天使….性格真的太好了，又都爽朗善良。宝泫小天使好好看（这么自然的整容脸韩娱女明星美商稍稍看看齐吧）最重要的是她太真诚了….学生妹特有的单纯和诚实….某种意义上，她和民在是一类人（哎我的天平已经向4399倾斜）。,favor
4008,6e0ed57ed49a59d74a4ea9445b7acfba8bf132bd,男,北京,其他,",老王看到有姑娘在网上提问整形医院做眼综合的医生是否可以给顾客做吸脂手术，老王在这说下，一般有临床执业资格，执业范围是外科专业的都是可以操作五官以及身体相关整容手术的，如果只是单纯考虑做吸脂，更建议选择脂肪专科医院或者脂肪专长的医生进行手术，相对临床经验会更丰富一些，对于手术的设计以及操作上的把控会更细致，也算是安全效果的一大保障。",none
669,4a2bfe460029609fddb5bf06973df9531b3e48ee,女,河南,其他,想整容了 哪儿都想do ,favor
4676,65e79d51635ac23b41ad852149b7311adfd071d8,女,湖南,其他,好漂亮的小姐姐啊，北京哪儿矫正的呢，想了解一下！,favor
561,5a48a576bf0a71ed373442c2bbc542ebb056d0b8,女,辽宁,其他,脸那么重要吗，多学点知识，掌握一项技能，靠能力吃饭,against
26,825b05d32323221726cc4780151219c573a5f0f1,女,四川,其他,无语了。。。之前祈雪灵祝的脸不好看吗？进局本来也只展示大头啊？现在改得像个整容脸在那儿坐台似的满意啦？,against
1597,1e8abd06f159827b9b6e4266a81f5424e311fbe4,男,广东,其他,今晚我发现我室友笑时，那个下巴好像黑粉黑明星整容过的点，但是我那个室友连口红都涂不好，更别说整容了,none
166,c399cb7b2db1cd12c1d677a359f3a1d2f716692f,女,上海,青年,而且那男的还他妈是个渣男，丑人多作怪,none
3475,ac6894387d6ce6832aaa7576ecbc15fb04b2cc84,女,贵州,青年,一个很久没见过的舅妈居然问我是不是整容了都认不出我了说我变化太大了,none
844,024ba19c90aafc22988118ba09120c83bda5fca7,男,江苏,其他,30年前的港姐季军的蔡少芬，那年她17岁，美到冒泡美到让人想犯罪。在看看现在娱乐圈这些歪瓜裂枣的！不是短就是粗还有就是丑，就靠整容和化妆生存，演技什么的就更不用提了。#迷惑行为大赏# 突袭手的微博视频 ,against
302,6ae21720cef54d4cf71b4fcdb97f47efbab393b8,女,其他,中青年,"翻看老同学的照片整容的我都认不出来了,北京",none
1080,44810496e887cdc604f7c7a90fdc8b0b6dc416bb,男,新疆,青年,此生有幸，那个没有日韩妆微整容的年代，最美的你是我最美的诗余生我就在身旁，愿生活的北风不再刺骨…… ,against
826,837b8c1608aad23f89e151302b3ff96e3a1f1b79,女,其他,其他,"我也,对ai脸过敏",against
195,6484b77220db5677eecdb891c7c8b078227078a0,女,海外,中青年,国庆节是整容的好时节啊，七天足够恢复期了,favor
2001,618d671de920815abbae90b3fccee836b519018c,女,重庆,中青年,姐妹们正畸前一定要多做功课，需要了解医院医生信息的可以自助查询网页链接  ，目前收录深圳各大主城（龙岗、盐田、坪山、大鹏新、宝安、光明、南山、龙华、福田、罗湖）都可推荐哦,favor
86,a4510fb864b6b77a5e39eacd4a21d758b4eb2992,男,广西,其他,#警方通报济南整形机构打人事件#不是明星不要整容，不是明星就没人看，没有任何价值，纯属浪费，整容是一条不归路，整完鼻子就想整眼，整完眼就想整脸，越搞越难看，越难看越搞，最后成了妖魔鬼怪。 ,against
801,1862f6e4e6e9255234405862aad06e8febef3a53,女,海外,其他,普通人整容真的要谨慎再谨慎，明星那么有钱找的都是好医院好医生，整的还那么不自然,favor
1136,a39bdff798e7f6c20194bbba1877914714e5c2b1,女,辽宁,其他,男人说不喜欢整容脸不代表真的不喜欢整容脸 只是喜欢看不出来整容的整容脸or整的好看的脸 ,favor
1832,9c1035804971c45d13a9a803c962c12c132b1dea,女,北京,中青年,刚才得到一个消息，最近有位男明星整容后遗症加上年纪也不小了，脸有些撑不住崩了，这个月又去做了医美，不知道下次出来修补的怎么样……,against
877,4ff75adf965d26b64b7af2327c9721e4debd59a4,女,海外,其他,"跟老公说我想整容,（其实一直都想整,想变漂亮,可是怕整毁,也怕他介意我整）他发来的一段话真的让我好安心哦",favor
1931,15801e121c79bc84f2610c9b815892eefbe66193,男,其他,其他,整容脸好出戏，说没整只整牙的都是在放狗臭屁，真是把别人当瞎子傻子！连小屏幕都看得出来，大荧幕想都别想！磨皮滤镜的后期辛苦了！它们的片酬有你们一份！整容只有一个结局就是毁容，从过去到现在没见到有好结果的，透支美丽来换取短期虚荣心和利益，看着一个个的整容脸，已经看到了它们的结局……,against
2600,eb7f91b62b95716ef0b6a8014d2bb69b97fdb112,女,四川,其他,昨晚看乒乓球去了，没怎么玩手机，今早打开豆瓣随手一刷，刷到了小凯整容澄清贴，时间还是去年的，我满脑子问号？然后真的刷到了造谣小凯整容的，这也太离谱了，本7年老粉看了要笑出声的程度，所以大家也认同王俊凯闭关＝修仙是吧，每一次出现都帅出新高度我真的觉得好好笑啊，去年瘦了被造谣整容，今年是因为什么啊？因为胖一点了？还有骂他丑，我也想丑成这样,none
238,618d671de920815abbae90b3fccee836b519018c,女,其他,其他,不敢整容，靠整牙换头深圳整牙案选自@深圳小助理说牙齿 患者牙齿情况是【牙齿深覆合、下牙一颗大牙做过烤瓷牙】，她之前平时不敢与人交流，不敢笑，女孩儿非常想做矫正，因为手里的预算也有限，不知道该怎样选择医院医生。在沟通并说明这个情况后，博主帮她分析了牙齿的情况，还帮她介绍了非常符合她心意的医院，后来她表示可以接受并开始矫正。正畸医生综合考虑了她的面型美观度和咬合健康，选择了预算折中的【陶瓷托槽牙套】，最终患者下巴的曲线柔和，嘴角上扬，笑得更加自然。。所以，只要找对了医院医生，你想要的美丽也一定会属于你的啦~集美们不知道该怎样选择医院医生的，想了解各大医院正畸费用的，都可以问博主#深圳 牙性深覆合/深覆盖/牙齿矫正/正畸 经验丰富的医院有哪个#,against
