id,userid,sex,adress,age,text,stance
3983,d06d8d50e36e0c52cdc88a83f7e1a73758aed51c,女,其他,青年,说实话对于我这种路人来说，什么明星整容开小号买热搜谈恋爱手滑点赞完全不是黑点。我不喜欢一个明星的原因只有两种，“你不符合我的审美”or“你实力不行”。,favor
3019,d2ce47d272673f74b28cc2c1bb84932d5324b516,女,上海,其他,不得不说，章子怡的脸还是很能扛得住大屏幕，自然而有表现力。只要不扮嫩，还是让人舒适。所以各路小花们，别再整容了吧……,against
1241,b7587fd12d5d8eb67897c73eebeeacacd1b2f5f0,女,海外,青年,天呐 整个容也需要澄清？爱美也有错？,favor
244,59bb18c246588ee854842df3c2bc9c4ad14d8518,女,山东,其他,"有钱的话我就去整容换头然后出道当明星，这样面对催婚的时候就可以说自己是正经上升时期明星,不谈恋爱！",favor
5388,0eb8652ef91bb36ca0b2372a693042f226cb3963,女,四川,其他,我也觉得这张11脸怪怪的,none
9553,1ace15307543a35c45d690ff2c7e54d301674ac4,男,黑龙江,其他,"我算是知道我段段爱情失败的原因了,每次我都希望理性讲道理,让另一半理解,不行,你要感化,要骗她,比如她喝可乐,你不能说可乐高碳水,你要买两箱给她喝,你不能说整容不好,你要鼓励她整,多整,反正最后三高,各种术后后遗症影响不到你,换一个就是了,当个善良的直男确实难,澳大利亚·墨尔本",against
6680,0ad038e5760473ed96ba22f1e33ee7bf1aa6c220,女,安徽,青年,"wy说我像整容脸,忍不了了整容脸要再发一遍,呼和浩特·内蒙古师范大学",against
1387,04ffff4c7a65727940948b8a799d89ddff1f40ed,女,江苏,其他,我也，暂时没有不动刀能改善的方法[苦涩],against
4916,41591bd930304ed9426630f0f4f6d056ec340794,男,天津,其他,刘浩存的下巴到底有没有整过？前三张是坚持认为她整容的网友列举的对比图，P4是粉丝做的澄清图，我看来看去……一会儿觉得整了一会儿觉得没整。不过这个事情吧，我一直觉得明星整容根本不算事儿，只要别明明是整容换头了还吹自己天生丽质就好，谁不想变得更美呢？,favor
206,d8f80ff069900cf8039935f9b6f61ec5c1e36203,女,四川,其他,死了都不整容,against
451,d97fa2b7e9deedf05a3718130a1b23f8ab6e815a,女,江苏,其他,瓣各种推的那部海岸xxx第一集就看不下去…好刻意做作！男主的脸整容感就算了，演技太一般了，刻意潇洒是另一种油腻好嘛！,against
5095,31770350fcb5cf6be59a1a0f47171f9954b1c923,女,其他,中青年,剌个双眼皮就能出道哈哈哈哈,none
897,eccd4adb82ef0f04ba621d9abe6a7285eb874b87,女,上海,青年,斗鱼的女主播像是量产的。什么垃圾歌火他们就去学什么，我曾经关注了好几个刚开播的女主播，很漂亮很可爱，后来再去看又发现她们和别的女主播没什么区别了，画一模一样的妆开很高的美颜。很多女主播，可能会突然停播几个月，然后又出来了接着播，鼻子更高了脸更尖了，眼睛也不太一样，不是反对整容，但是她们为什么整容我们都明白。米娜娜只是一个稍微幸运的个例罢了，但她同样也经历着这些。,against
1501,ab78236a27c230f977a09769a42e67ab7ee2faee,女,其他,其他,"每次我一追星,看到喜欢的明星我就想整容,好难受啊😭还有每次我一没事干一难受的时候我就想买东西,又发现自己没钱就更难受,像现在高考结束,成绩也不好,什么事情都没有,录取情况也没有,我每天就是这种难受的生活反反复复,没钱买东西穷的感受最难受😭你们有没有同感的",favor
9558,fe1488b32a4487872e9d0a165de9d5919de6d04a,男,吉林,其他,"南极人,女士保暖内衣2套,59,我就一看见“美容”，就想起自己脸上的斑点。一听见“整容”，就想起自己很不瓜子的脸型。之所以迟迟没有动手，是想等到八十岁，钱也攒够了而且不心疼了，皱纹也长得不能再长了，眼皮也耷拉得不能再耷拉了，到时候一次性修理修理，弄个够级别的妖精。",favor
79,c889c8c5bc9af425f8e7363572245d4000dd711b,女,其他,中青年,有些角色看不出来是同一个人演的那是演技好，可另外一些看不出来完全是因为这个演员整容了。换头式演技可能真是换了个头，所以有些人能别买通稿自吹了吗。,against
123,0935ba6f172ad1aef57040754ba89dfebdfbec3f,女,其他,青年,"我不认为女明星整容是什么见不得人的黑料，但前提是你得整的好看，整的六亲不认脸还僵,就不好了，更可怕的是粉丝一个拿着精修图吹盛世美颜，二十岁时差距大不一样的原因是长开了，拜托，脸都僵了，脸型都变了你跟我说长开了没错我就是在说那个滋滋",favor
1427,6a8b19229822e8664761bc6d56f101a2eab1bd03,女,其他,其他,问题是就是傻X光明日报的也只说在电视剧和综艺这种非必要浓妆情况下的浓妆该杜绝，毕竟传统戏剧舞台妆都很浓。笑的，这是给整容航业带风向呢？是不是ZB又进了整容行业了？,against
3452,f1504896fe91f49009ebe6faad5ec6b9aeb2bfe0,女,河北,其他,我是服了，这个视频你看过没有啊就说整容失败了，那明明是做双眼皮埋线了然后又把线给拆了,none
241,6cc8a5da70bab1396e94b20a959c65e00cb65c05,女,广东,青年,关于微整容，我身边最多的就是割双眼皮，割的时候也太痛苦了吧，看着都疼不过回复一段时间以后还是很漂亮的，微整容一定要注意安全哦 徐州·睢宁县 ,favor
4103,3750f085d01419f16be876baeb161d3df6048bf8,男,其他,其他,王佑硕到底为什么要把自己整成这样呀我靠王宽的时候巨喜欢他的长相呀！小侯爷的时候也巨好看！我还等着他大火呢，没想到现在活脱脱一个整容脸，嘴巴，下巴，额头，眼睛，鼻子，靠！,against
1513,2c5236ba9159039444bd4eb5be1854447aabf46f,女,其他,其他,我单纯觉得她的脸有点填充过了,against
7654,d28b2412b55e0c33da3f923a99e0f0df93190429,女,北京,其他,"真的很烦一些博主打着拒绝容貌焦虑的旗号对女明星整容指指点点人家爱怎么整怎么整关你屁事反容貌焦虑之前,麻烦记住一句“管好你自己”",favor
1682,24283cea7d3a5e8a8e4b2d948c0f720908ba8d93,女,广东,青年,可不可以安排内娱男星集体整容。。最好都往李栋旭那种标准整。我不在乎脸是不是真的。我只想看好看的//@小Cynthia:这是为什么即使人设感觉不太符合，我也很期待杨洋了//@热甜瓜:从哪儿找来的丑男人//@_Nostalgic大风_:陷入沉默,favor
6458,d874657754a553cd6791f3da5592d4177068fd65,女,福建,青年,开闭目前我熟的人里面基本都是微调，有哪个孩子大整了？有人科普一下吗,favor
4775,c5bdd3d5e3b6c06dd12eaf5b1503af5efe3aeb12,女,其他,中青年,刷到jessic姐年轻时候没整容的片段，以前好可爱吧，真的特别可爱啊，姐不整容也好看啊,none
2379,77cb7e572fc0ab29bb28b02ffacd895267860510,女,其他,其他,这张广告图修的太过了，他的脸不适合过度修图，视频截图很自然，也可以看看他近期视频，从小看着长大的，一直都很好看,none
1746,d450173ae205b7d160f0722cf240ce4c1515bff0,女,上海,其他,大众整体审美水平有所下降szd,none
1163,62421dfa64d7db201202984a14a90a720da1800c,男,其他,其他,不是吧整容在你河也算是污点了吗你河整容的多了去了，你如果不是粉丝的话真的会在意她整容吗,favor
5124,d755de8d703e4286e0531afa405ff2e05fec2249,男,上海,其他,"明星会去整形医院做医美保养吗？八卦一下拉很多明星不去医院，她们自己家里就有操作室，明星的整容是签保密协议的，如果被公开，面临巨额赔偿，很多明星的皮肤真的不好！！！人看起来很疲惫，很多网红也是这样子，有的网红卸了妆像男的！明星去医院的话，一般医院都会清空，不会留闲杂人等，都是一些我们信任的人，人数不会多，一般是5个人左右，明星基本上靠微调，出道之前就已经整改不少了。明星很信风水！非常信！我们看到明星，也很激动………哈哈哈哈！,上海",none
4094,6a3874b7e12be3d520af9970ac0da0f6c4c99a97,女,上海,中青年,"姆咪的金尾巴也被质疑了,就像明星总是被质疑整容一样。。所谓的名气啊",none
1452,a6b8191b816d2017fa13bbacb86aaae525b30412,女,浙江,青年,"转移重心点！可以把整容的钱拿去买房买车都行！人无完人,但其实想整也没有啥问题,希望你能开心就行啦,难得活一趟",favor
6214,2168d0cb1bb92fb1b44d8826d6d582407e89e635,男,安徽,其他,"@沈涛,您寄吧谁呀，喝星巴克把脑子喝坏了吧，直接把毛毛照片往上一趴，骂人家整容没整好，您怎么不照镜子看看您自己什么逼样，建议男德班@男德,收了你好好教你什么是礼貌",none
1845,2c90f74d63165cec881c279eb5bcb0d5d94c5ec6,男,四川,其他,都这么美了不需要再装修了吧…,none
1167,4fe3b65792faed02b707f65981a2f4a141bed4b6,女,北京,青年,#云南虫谷#  明星能不能不要乱打针整容啊，微表情都做不了，根本看不出来演技。另外男明星能不能控制控制体重啊，脸也太油腻了。 ,against
1491,a4a9c98825b60b6c2b978d04ecbd00690e3cb85a,女,其他,其他,照着别人整会走钟风险大,none
1635,328637a4d305f062231ea22d1eec38fdc7ff98cc,女,北京,其他,"明星和网红整容现在已经不是什么新鲜事，但仅凭整容能被各国媒体争相报道的不多，英国网红欧利·朗顿就做到了。因为他直接跨越种族，把自己整容成了韩国人。早在2014年，有一位25岁的巴西男子就把自己整容成了韩国人。有跨越种族的整容，还有跨越次元的……Rodrigo,Alves,因为疯狂迷恋芭比娃娃的男友Ken，便花重金改头换面。说起来，整容就像拆盲盒，如果整得好，产生了质的飞跃，事业和外表都会更上一层楼，但若拆到的是一个坏的，就是无尽的苦果了。",favor
1091,0c9152ec9ee082be46c2c861fcec3ef525bc03b7,女,浙江,其他,我也想去做医美了 好皮肤很重要,favor
1459,ddd992edbee3e6bb2ebbf3bf08e762000982c171,女,广东,中青年,"去疤总比整容容易吧,然后大结局还要顶着天雪的脸",against
771,42b1004d72bf78546656772c8dda1df9a34cc834,女,广东,青年,小小徐额头饱满鼻子挺拔给妈省掉一笔整容钱很不错👍🏿,none
726,06c5a9e99c0b80a3eef37a58ac662673e8fc8ca1,女,其他,其他,是真的好好恢复！越来越美,none
1250,1fdd057770a56504670beeabf64bff2be0657d6a,女,香港,其他,整容的人能分辨的出回头率是来自美貌还是整容痕迹过大，五官不协调引起的注视吗？这样怎么知道自己整的效果好不好呀……没有说整容不好的意思，纯属好奇,none
4548,2bc8bff07747b4736f247e86cb0d9bfbcdbf3593,女,其他,其他,"星黛露,刚入坑想问下到底哪家装全身骨架比较靠谱啊啊啊啊啊微整容又是哪里比较好啊",favor
3887,2e6b026875c0ec2e6dafdcd1b3a39a6688704dcd,女,四川,其他,"什么？罗志祥居然也整容了！,是的你没有听错啦，小猪罗志祥也是经过微调整的，所以为什么还要暗搓搓内涵前女友整容脸呢？,鼻鼻带大家看一次他早期的照片哈，可以看出他的卧蚕绝对是原始天生的，然而，卧蚕居然和他的眼睛宽度一样。而且这个眼皮真的不能更单啦！再看看他的眼皮，明显脂肪过多，下垂，年纪轻轻这个眼皮就耷拉下来了！,后期割了,，可能还去了脂肪，整个眼睛都大颗了起来，和他浓颜五官也更加协调了！,其实例如我们熟知的，黄晓明，男神金城武，都是有操作过双眼皮啦，所以男生什么的也不用害羞，觉得整形只是女生的专利，每个人都有变美的权利！",favor
5886,5df80ca47b7f5ddfaf3dc23b7622f4d314637de8,女,其他,其他,今天我的同学说，鞠婧祎是靠整容火的，哼，整容？切，你醒醒吧，鞠婧祎没有整容，如果整容的话，丝芭不可能收她，因为丝芭不说整容的明星，懂吗？还有一个同学说，鞠婧祎粉丝都没我家关晓彤多，我听这就话立马就生气了，是，鞠婧祎的粉丝是比关晓彤少，但是她159的身高，撑起了2040万人的一变天，你知道吗。求求你们了，放下尊严，去理解她，她真的没有你们想象中的那样，她真的很好。求求中国网友放过鞠婧祎。,none
1960,45b77be01fc0d6a734a9fd7e7ccec235d7d706fa,男,江苏,青年,总有一天这个世界会发明自助上门整容服务 就是小程序下单一下要整哪里 哪个医生 怎么整 最好是贴上一张p过的本人效果图 然后我本人美美地坐在家里等医生来给我捏脸✌🏻 ,favor
405,37f4d6d3e9eb667039e6138a9afb4346270a40b6,女,广东,青年,"我真好无语啊,演个七八十年代电视剧你找个整容脸…真的有演技吗……",against
3747,18150c20f2834efce1e9a522efa835a8e24342eb,女,北京,其他,"女布整容好看本质也是剪布，底层逻辑不会变。基本上婚恋情况会从男人嫌弃长相，自己跪舔。变成整容好看了以后，外貌不会被diss,，但是一般还是会找男剪。她们在婚恋这块还是需要付出布性才能维持关系。所以对女剪的敌意很大。可以理解，要避免这种情况，勿高攀勿高攀",none
490,605cca12bb3916b143a271fbb7abec8034c7bf5f,男,北京,其他,我什么时候才能赚到足够的钱整容,favor
1003,38eaebd7f376257026c20ef831c33d035e211747,女,湖北,其他,"整容真的会改变命运吗？我觉得不会直接改变，但是能够经受恢复期的那段煎熬时光。会让一个女孩变得更坚韧和自信，这才是能改变自己现状的精神价值！,仙女颜纠所的微博视频",favor
3418,3fc68595bbfa2369308785041357d9627049159b,男,其他,老年,国内明星敢在媒体面前大方承认整容过的估计只有郑爽了吧！为她的直爽点赞，整容后的郑爽确实也越来越漂亮！楚雨荨时期的她满脸的胶原蛋白，小家碧玉，清纯可人。但面部轮廓和五官不算精致，特别是鼻子，山根比较低，让鼻子看起来比较塌，导致整个脸部的立体感不是很明显，下巴也很圆润。现在的郑爽：圆润的下巴变成了比较尖的下巴，以前的宽脸颊也成了瓜子脸，特别是鼻子变高后，真个人的气质明显的提升了不少，从邻家小妹成了大气女神，美丽不减还多了份女人味，戏路也更广了。不得不说好看的鼻子很重要，塌鼻子显脸大。同样的脸型，塌鼻子大鼻头，就是会让脸看起来更宽更扁平，挺俏的鼻子则让脸变得更立体，脸看起来就变小了,favor
4246,4c35b7968e524f3c9fdf4bcd573340ce1d31b487,女,上海,其他,想到前台的一小妹妹整完后觉得自己可以找更好的就和前男友分手很快被一富二代短择，蹉跎了几年后富二代告诉她父母不同意也不可能娶她，遂被分手，又觉得自己耽误不了回头找前男友复合,none
1606,9470f5c2d4477a696e7bf151b6ae0fa18bd947c1,男,北京区,中青年,",制造美容焦虑的医美广告要不得。近年来，颜值经济持续升温，各种医美机构、医美服务的广告呈井喷之势。在利益的驱动下，医美广告的虚假宣传、过度宣传、导向不正等问题也逐渐增多，有的甚至将容貌出众与“成功”不当关联，编造“整容改变命运”的故事，助长社会的“容貌焦虑”情绪，误导消费者。医美是一个颜值行业，也是一项健康产业，广告行不行是个重要问题。加大执法、处罚力度，网络平台建立健全审核机制，才能彻底根治医美广告领域的顽疾。还要整治对审美标准、消费观念的恶意营销。消费者更应建立健康理性的审美观和消费观，对待医美广告，多一份审慎。",against
1843,95bc0283d833edcfee85b9147154509467433889,女,四川,青年,"人生第一次，被机场安检小姐姐扣下，问，您是整容了吗？,无锡·苏南硕放国际机场",none
1732,4fb1fd15a3110fe920656956430e47d52265087b,女,海外,其他,天天喊着我要整容，但是仔细端详自己的脸哪哪都很喜欢，好爱自己的人 ,against
1434,83722ed55d5c20a8ab64cb6fee9c4398fc0e5d0a,女,其他,中青年,与其要担整容失败的风险，不如想想如何提升自身的气质，会比一张不真实的脸更有吸引力吧！,against
4868,285184805659f671340ee7358d9e6e322feeafb8,女,江苏,中青年,你亲戚家的美容院在哪里？,none
709,733faf2acd637228c384f2a68791fd4c0ce9ad34,女,海外,其他,"尚气,好看！试问哪个少女不想骑龙斩妖除魔喔,整个世界构造得也很好还有,梁朝伟是真的帅！！！从行运超人到文武,他怎么会一直这么帅,演技整容,帅到我对演他儿子的都宽容了,请问有谁能像尚气继承十环一样继承梁朝伟的帅气和演技喔！",none
232,32c9bc29b22647f988570753f2352abfc38f6c5c,男,广东,其他,这就算是真的整了，也没以前好看啊，怎么想的,against
941,b0d1c88afe344aca9fbe5ddd3b2cf5118dedce07,女,内蒙古,中青年,真是无聊，一个富二代整容后，变成明星了？你会啥？唱歌？跳舞？除了带货买东西，还会点啥？真心找不出来,against
4682,be71d0688dd60b021a66ad7d7617eeab06573273,女,海外,其他,我的审美就是伊娃格林，王祖贤，刘亦菲，朱珠这类型的，整容脸和蛇精网红脸真欣赏不来,against
429,ae28ad1e0cf4f4088418fb3cd7d78f495ebc8973,女,安徽,其他,我不敢打什么针，顺其自然就行了，接受衰老,against
1161,30603242d412c8bc3b6cb9ed646969fff5fc3a97,女,湖北,其他,为什么总有人觉得未成年不能整容？这又是什么新型粉丝澄清洗脑包。KPOP工业已经给未成年整容很久了，就算是如今2021年，我们也能看到不少04年的爱豆在整容，家长同意就行。以前少时退出的那个姐姐，她的采访看过吧？她那会儿也就十六七吧，公司让她整，她不愿意，加上个人意愿就退团了。爱豆出道前去整个容，多么正常。而kpop爱豆出道时，很多都没有十八岁。不要用我们的眼光看爱豆，我们觉得整容是大事情，要心理成熟了才能去面对。但是爱豆是青春饭啊，早整完对她们职业生涯有很大好处的。,favor
2000,85e6d72a84b12d90d95bf418396300fb64f2ffff,男,其他,其他,这辈子不能整容成这样我不活了,favor
1876,a9711f2b4e33cf4364f319148bb25648d09c9982,女,海外,其他,"尚雯婕…,微整容就行了，把山根垫的跟欧美人一样…,很不自然，脸也有点僵…",against
1181,2787b1dd64277181b035cdefb2f722ffcd1723cb,女,其他,其他,不是很理解一些一边喜欢宫脇咲良一边骂鞠整容的该不会是真心认为樱花女士没有整容吧,against
709,54321408691249da611e0a02d24e7ee5af747238,女,北京,其他,在娱乐圈中，为了变美去整容的明星有很多，敢于承认整过容的明星也有，否认自己整容的明星占大部分。从童星看着长大的明星也有很多，杨紫就是其中之一。杨紫，作为一线明星，小编觉得她与圈内很多明星不一样。不仅长得十分可爱，而且有搞笑的性格，是个开心果无疑！很多与她合作过的明星都十分喜欢她，觉得这个女孩大大咧咧，比较单纯。最近，杨紫的近照曝光，让人觉得她与以前不一样了，头有点肿肿的，脸上苹果肌看起来不自然，之前的她可以开怀大笑，现在的她在笑时，只是轻轻的动下嘴唇，而且眼睛浮肿，难道是因为太辛苦没休息吗？这边观众刚刚还在疑惑，另一边杨紫工作室很快发出了精修图。精修图的照片与生图差别实在太大。没有精修过的图片，肌肤看起来没有凹陷的地方，如今的精修图，笑起来两边脸颊还是凸起的。有些网友看到后表示非常惊讶：难道是填充太过了？怎么跟气球一样？感觉她的额头怪怪的。其实，在杨紫的修图没出来前，曾经被记者拍到她去过整形医院，当时被质疑是否去整容时，杨紫晒出自己一张毛孔发炎图，表示自己是去做护肤，这件事情才消沉了下去。小编认为，爱美之心人皆有之，这是十分正常的事情。对于杨紫的容貌，相信很多观众最熟悉不过了。早先在《青云志》这部剧中，就发现杨紫变漂亮了不少，五官也精致了很多。不管怎么样，演员们的演技才是最重要的，所以，我们对于杨紫的外形也不能有太多的要求，大家说是不是呢？,favor
1972,b20741f218f7266d7aa53c61acb41da879657cec,男,其他,其他,"我就相反了,疫情期间回国隔离21天就为了整鼻子➕整完又回韩国居家隔离14天",favor
7054,4aebe767ebdeafcc3760c9d0647a5a5395f9e80b,女,其他,中青年,希望国家能整治这种歪风邪气！什么不入流的东西都能当明星！整容，化妆，精修图……以前的老艺术家靠的是实力，现在的演员靠的是营销包装！是个人都能当明星，赚钱，动不动就几百万一天，几亿一个电视剧，请问价值在哪？不要以为明星高人一等，还有那些脑残，理智一点好吗？,against
3044,f0bb71b91bfef31d8e13e14056cc6893f2ef9bd0,男,海外,青年,每个假期回来都有人不认识我真的没有整容也没有换脸但是有些意想不到的人竟然还认识[开学季],none
874,60b6c336b8882db689e04c1f70a580e3e3411460,女,浙江,其他,我就是人瘦，鼻子高，脸型也还可以。做了双眼皮，然后现在在整牙。,favor
1866,c425f17c434c8d447f0ac300f1dd8317b7d37a98,男,四川,其他,想要矫正，不敢尝试　　　　　　　　　　　　　　　　　　　　　　　,favor
10287,3c6c0280ecf2eeffa1d2f72878df2860bb48d8e6,女,广东,青年,姐妹们！可以不用去医院整容了！！！,none
1238,8ee38ee4d665dd7ed751bbd3be7c92054fa29fb2,男,北京,其他,",孟川这期的脱口秀讽刺值拉满了先是讽刺部分网友上纲上线过度解读，然后讽刺部分粉丝无节制追星，最后讽刺偶像整容(虽然我觉得这条没必要，但的确文本很顶)最后的最后其实还讽刺了偶像塌房无期，全程太刺激了大家还是自己去看吧",against
3345,6695b6c369c0ce6edbd43f790f447250582fc5cf,女,海外,其他,"有些图不要修的太过分好吗,空瓶图让我以为你家哥哥整容了对,就是到处控评的那家",none
348,d7ee2be7bb5e2ccc57548cf6902411b0d5a7f648,女,上海,青年,"一、你活儿要好。二、微整容。记住最重要的三、你要有钱。你要是有了第三条就可以忽略前两条！,本人男，长得丑，感到自卑怎么办？",favor
1880,b7e5bef5169bb19351bee94352b1d60d25e35e05,女,重庆,中青年,她真不行，演技浮夸，面部僵硬五官乱飞就很狰狞，台词也是，司藤的时候她也很尬。,against
1088,d37c3e386379df9534e863a9b726c65279625de7,男,江苏,中青年,看来一些所谓的帅哥男明星都是假的，整容让他们走上事业巅峰……还是素人帅男最靠谱,against
530,12d1cadd4c4c99b5b421f7f5d791e8a92568e4f3,女,北京,中青年,"看人千万不要看外表，整容女生的心也是很善良的！,辣眼也要看的微博视频",favor
1090,c29e91527d378052e59fd6a342232fecf5eaec37,男,海外,青年,网易你有事吗？？？？花了钱换脸后每次魁地奇都这副整容失败的鬼样子？？？怎么我的美丽容颜还是仅自己可见的？,against
3202,59bec5b12b074b5f57314204428257db1f519972,男,北京,其他,"央视揭美丽贷套路：想要高薪工作,先去整容！,央视网快看的微博视频",against
1492,b5db40de2405ead59baded052d272c12b0f04588,男,浙江,其他,"整容市场需求大乱象多,学生微整容要有安全意识网页链接",against
208,ce65d4eb5c69403b562192fb83cb80eefc1a727f,女,北京,其他,想要变美的仙女一定要提前做好功课，了解面部分析和变美思路都可以问我哦，最重要的就是医院医生的选择，快速自助查询医院医生：网页链接,favor
373,00db59a3a916f1952e93a1dc98398da5f1722f75,女,湖北,中青年,"不是你容颜易老，而是抗衰做的太少～眼里有光的女人，星辰大海都比不上[爱心]🇨🇭瑞士微科不是整容，而是最高级的医疗保养,Alice-小敏的微博视频",favor
1793,4de0adaa3e8b8c632d008153e15ccf2eb067ea19,女,澳门,其他,"@siuga汁,老婶子最高热度6600平均4000+的铁血扑街剧微商里害没让钻风意识到老姨是多么的nbcs的话，那最近的土味儿和整容脸廉价路透都无人议论了更绝望了吧，欸，看见前队友改个签名那么多人关注急了就是说…",against
243,4ee03b7cf25a04ef53913fd88750d03a19ccc3de,女,海外,其他,聂吗，我甚至去看了学校拍的证件照，也没这么丑啊,none
6209,cbfe7c97a5d600aa20fff2cefac43084314f2780,女,其他,青年,是的，身边有人割个双眼皮都很别扭。医生很重要,none
179,5e8a173929f58cd29f4b042ade586f2941377867,女,其他,其他,明星整容不很正常的嘛，只是那些私生活有点让人大跌眼镜,favor
1938,a63315f426a85be67d60dc315c6b264e8a0de49f,女,其他,青年,"不得不承认,自己实在太平庸了,平庸到自卑,真想变得好好看,长得好看优势真的很大弄得我现在非常想去整容",favor
87,7b5685e70baf5bde547544a824ccda37f0a2d0ef,男,上海,其他,为什么整容一眼就能看出来？,none
