id,userid,sex,adress,age,text,stance
5332,f12aaa2176807cbd5c4ec3dac48db16b038421aa,男,上海,中青年,凡是成年人和孩子都喜欢且跟学业无关的东西，都会被认为是有害的而遭到管制，导致成年人也没得娱乐。那么大家都别生孩子不就好了吗？没有小孩没有学业，而且有更多时间金钱用于自己的娱乐，皆大欢喜,against
566,5abd73ae3ca74440dc54e33fc66c4e7092321bde,女,海外,中青年,我打游戏时间长了就会头晕犯恶心[苦涩]所以根本没法上瘾，也就氪金类的花的多一点，但是时间长了也会犯困睡着,none
154,29174f66d302b34755cefe2eca8543e2be1890f5,男,上海,其他,不容易啊，说的是《水浒传》，没有说是“精神鸦片”电子游戏毁了他家孩子...//@冬亚:看最后被告人家属说的话，真特么，难怪孩子这样。这特么是自己地域黑自己呢？？？,against
1501,daf2029b7babb7151131df866097402e37b9f241,女,其他,其他,",王者央媒点名,央媒点名王者荣耀,国家终于出手了,批网游是精神鸦片,游戏主播窒息时刻的微博视频",favor
2309,f2bf96c8dbf64f01dfbf03eca45a2b39445a0c53,男,其他,其他,"以腾讯为代表的游戏厂商，一方面大吃人血馒头;一方面勾结恶媒谣记妖魔化网瘾戒治。游戏商暴富的背后，究竟残害了多少华季少年和家庭?!@CCTV焦点访谈,@中国政府网,@世界卫生组织,@人民网,@健康中国,@山东发布,@紫光阁,@共青团中央,@参考消息,@大众网,@光明网,@检察日报,@法制网,@临沂发布,@齐鲁网",favor
5238,0de41655b4a7bebd1f083707068f68fe6e1c5b5e,男,江苏,其他,货没以前纯了属于是，以前是电子海洛因来着,none
2482,f4ddce47af0d8077fa1133a555fc9a96892e30fb,女,四川,中青年,#突然的想法#对香水多了一个概念，不准确的描述是精神鸦片。香水是一个自己的理想世界，与现实世界共进或者交融的态度。内心情感、理想世界通过嗅觉来感受、追寻。跟听歌类似，音乐听觉，节奏音符承载很多情愫、故事。味觉、视觉同理。大脑保持对人生的体悟，建设自己的思想体系，丰盈内在；眼耳口鼻手对应视听味嗅触觉，丰富身体对世界的感知，调和感知的层次，寻找到自己的理想世界。内在的体悟和外在的感知互相成就，知、见、识不断更新体悟和感知，用终生形成个人。,none
5329,7e862239dbcb37fe70243ac2e78f0783a0dfc737,男,其他,中青年,同理，一切的娱乐活动都可以说成精神鸦片，有坏与否，全在一个分寸的把握。,none
2145,c38a6b1c57ae1c7e738ff1d9551f959dbfa6e0ad,男,广东,青年,"下定决心腾讯游戏退款了,要是能退两万多的话我就在微博抽两个Switch,警惕大家远离电子鸦片",favor
4002,76ed4c38057c67acd817ea373acb12d3cec1a31a,男,河南,中老年,是呀，由游戏产生正比经济效益的只能说是偶尔中的偶尔吧，而且于终身好像并无益…,favor
1805,84b44e6efc05db18700b1e428f1c6d79acd14983,男,天津,其他,在中国人的传统文化里，历来是不玩电子游戏的！电子游戏是西方世界的产物，因此玩游戏的那些人，包括那些为游戏洗地的人，多半是jwsl，需要调查调查！,none
1756,23d9a11158b6c032f3f78a40f4d064a197b82890,女,四川,中青年,",我想电子游戏开发出来的目的是为了让大家在茶余饭后用娱乐消遣的方式缓解压力，而不是为了让大家整日用玩游戏的方式支撑生活。开发商制造出电子游戏，也是为了让大家的生活方式变得更多样化，生活变得更有趣味，所在在孩子疯狂玩游戏一事上，不能责怪游戏开发商。孩子玩游戏时间的长短，也并非是由他们控制的。如果控制了孩子玩游戏的时间，让孩子玩游戏也并非坏事。因为一方面玩游戏可以提升孩子大脑的智力，另外一方面也可以舒缓孩子学业的压力，让孩子在玩耍中感受到快乐。其实孩子沉迷于游戏中，究其原因主要有两点。第一点是孩子的自控力比较差，当喜欢上玩游戏后根本停不下来，反而越来越被游戏本身吸引。第二点是孩子的看护人没能管好孩子，最开始父母没把孩子玩游戏一事放在心上，没有多加看管多加限制，久而久之孩子玩游戏的时间就越来越长，最终导致孩子沉迷于游戏中。",against
120,f4567fdda0f72a701f119d551c82f2ebdfb5dca1,男,福建,中青年,当年的网瘾战争，我们赢了么？没有。。。哪怕是现在，我们依旧没有看到胜利的希望。杨永信依旧当着雷电法王。当年那些被电击的人依旧有着心理阴影。而游戏又一次又一次又一次的被冠以精神鸦片。这场战争。输了是输了。哪怕赢了也是输了。,favor
1348,9dd942879f1989b33fc600ef77d88a33a2ed686a,男,北京,中青年,"心理学家扬（K.S.Young）提出了网瘾八条标准，如果满足其中的五项，就属于“病理性网络使用”1-整天对互联网念念不忘2-为了获得满足感在互联网上花费的时间越来越多3-试图减少花在互联网上的时间但没有成功4-在不上网的时候觉得坐立不安、喜怒无常或情绪低迷5-上网时间比预期的长6-为上网牺牲了与家庭和朋友的关系7-对家庭成员撒谎试图隐瞒上网时间8-把互联网作为逃避问题的手段。人们会对电子游戏上瘾，最本质的原因是它天然具备吸引人的要素：承担艰巨的挑战，产生肾上腺素，它能让人自信、精力充沛和干劲十足。在我们沉浸网络游戏时，身体会体验到一种名为“兴趣”的生物化学流，也成为“内源性鸦片”，其中包含能让我们感到自身强大、万事在握的内啡肽，以及比吗啡强80倍的“幸福”神经递质β-内啡肽。北京大学心理与认知科学学院副教授张晰说，这和祖先的生存本能直接相关，就是打不过就跑的一种反应。它的生理基础是你看到危险的时候，会分泌这些神经递质保持亢奋，或者说增加活动性，要不你就跑得比别人快，要不你就打的力量比别人大，增加生存概率。✨不过，网游真的百害而无一利吗？游戏对现实有正向作用吗？我们经常说沉迷于游戏是为了逃避现实，如果是用来克服现实的困境，这是一种有益的逃避。能感受到经过游戏化改造能让人的行为变积极的是微信读书。微信读书的界面做得像游戏一样。游戏里领任务，就相当于你要读多少页书。读书时间越长，积累书币越多，就能拿去买新书，这已经形成了良性循环。其实，当我们了解网络游戏为什么让人沉迷，或许也可反向提出解决办法。“所有孩子如果让他接触一个新奇的事物，不能说是沉迷，但他都会花很多时间去做。他有兴趣画画也好、下棋也好，都会在好奇心的驱动下去学习和练习，家长在这个过程中不断地鼓励，让孩子收到即时反馈和成就感，也能不断强化这种兴趣行为。原理跟打电子游戏是一样的。”节选自,《我们如何与电子游戏相处》文,杨璐",none
5143,b1d0fdb215bb207df986602ca2e973a94668652d,男,云南,其他,",恶意操纵股价，公安民警应当立刻逮捕涉事人员",none
3338,48b6daad4471444c46ddfcfb0d9cc9f57123c7c1,男,其他,其他,回复@为有书香来:宣传力度的大小，也不是你一句废话能阻碍的，沉迷游戏请先问责家长,against
5,ddd521b201ac6a53630aec788d0512e683397545,女,其他,青年,抖音和小红书简直是新时代的精神鸦片，克制自己的最好方法就是卸载。,favor
2298,2d36c1eb7af5d9cca0db25f986a384316b824f81,男,山东,其他,"网瘾对青少年造成的伤害不亚于毒品，不只是对身体的摧残，心理伤害是最大的，它能让人丧失理智和人性，如不及时遏止，祸及家庭危害社会，后患无穷。@中国政府网,@人民网,@人民日报,@中国政府网,@健康中国,@山东发布,@中国文明网,@世界卫生组织,@CCTV焦点访谈,@大众网,@法制日报,@光明网,@工人日报",favor
5320,1f3b9db906ffbc4ce124a91491016d89b52df1a6,男,辽宁,中青年,"不明白为什么有的家长会支持禁网络游戏，这样别人不就发现你孩子没出息其实是因为笨了吗,沈阳",against
5164,f3df34353be1a60dbc436a037403af1beae19901,女,其他,其他,经济参考报的小编的脑子是不是被驴给踢了？看着踢的还不轻。网络游戏是精神鸦片？放你奶奶个嘴。本人就喜欢和平精英，怎么也不上瘾啊？游戏本来就是中性的，跟网络是一样的，看你怎么用，指什么样的人用。你他爹的这样一棍子打死，是不是脑子有问题啊？,against
3736,43f805f2f488d46636ae6ef9f98cd65a98b63886,男,北京,其他,孩子沉迷网游这个还是挺难管的...每天玩儿半个小时我觉得是极限,none
4440,dec2b7deba982f1527ae82ab0e5bcfd2b88cb8db,男,其他,青年,"时间真的过得好快,我们总说要珍惜时间,可当我们沉浸在自己觉得很舒服其实堕落的环境时,它总从我们指缝中悄悄溜走了,等我们再回头看,发现谁也没办法让他们回来了,然后再去感叹为什么过得那么快,我却从来没有认真生活过,精神鸦片确实该治了,也该好好想想自己想成为什么样的人,然后耐住寂寞和诱惑,努力沉淀自己,我相信一切努力都不会白费,一切都会有结果",favor
5282,e437090265fc160884916829ebc7bae55fdd93b4,女,山东,中老年,",说网络游戏是“精神鸦片”，不妥吧，按这种思路，短视频、直播啥的都得算进去。我觉得网络游戏很像是金钱的诱惑，君子爱财，取之有道。关键是玩游戏的人，需要修炼，也可能到最后就是优胜劣汰，能够调整状态，规划好时间的，这个就成为了一种放松；而实在是没有抵制力的，沉迷于此的就被淘汰。我们更应该反思为什么中国的孩子更多的会沉迷于此，是不是中国的孩子更多的不能独立思考，自主意识太弱造成的？",against
883,de1977bab4369620f041fe7752d847359ca81878,男,浙江,其他,"同样为了打发时间，我选择看书来充实自己，而坐在一旁的铁five选择玩电子鸦片来自我麻痹，孰强孰弱，高下立判,头昏体乏的秒拍视频",favor
1718,c6aedb0554ea3960aed9e030326de883fa835ac0,男,天津,中青年,沉迷过实况足球,none
409,661321f7a003f6304d627efa52f5a8e94da1bc06,男,上海,其他,无经济能力，玩原神嗜赌成性，抽角色欠了两万块钱，父母拒绝帮助，走投无路录视频诉苦抱怨父母，抱怨借贷，但从来没反思过抽卡机制和自己的自制力，到最后还不忘夸原神是个好游戏。就像是借钱去赌场被骗了个底朝天，出门还不忘夸句这赌场服务真好阳光好刺眼啊~,favor
2927,7e19e25e663175d944a9e0c3ae6ddbce34f6aa17,男,北京,其他,正常，本来我一个正经财经博主，因为前几年开始的各种管控，各种不许妄议，这不生生快变成美食博主了么……当初也想过往游戏博主方向努力，可是“精神鸦片”不说，国行游戏的各种限制和阉割，管控也是预料的到的，宠物博主吧又不想天天拿自己家喵当工具，最后还是自己做菜安全点,none
5135,e2a2ed4159fff9f66aee4c44cca7c39249b8e376,男,海外,其他,沉迷于健身就没话说了,none
133,600ad7079b87ba450e950452f49981607b7cb155,女,广东,其他,为什么这个时代都在怪游戏？你们凭啥说游戏是“精神鸦片”？就因为孩子成绩不好自己管不了就怪游戏？每个时代都有那个年代的娱乐方式，请别说游戏害孩子了，说真的，那些骂游戏的家长是咋想的呀？大人们你们天天说游戏毁孩子，难道你们儿时不也一样吗？就拿小说来说吧！过去家长把看小说当成毁了孩子的东西，可现在呢？不也到了人们的认可？游戏也一样，你们现在反对等于把儿时的你们当成“吸毒者”可能看完这个文章的家长们会说我乱说，其实你们的反对游戏的声音就是用来反对你们儿时的娱乐方式，我写这文章只是为了反对那些为了逃避自己对孩子的教育失败而用游戏来背锅的家长。,against
1181,cd68ad48dbd9dfdcb8a7b9ec816bc8c5de32b2ff,女,北京,中青年,终于有个可以脱离手机，人与人之间面对面交流的活动了，又变成精神鸦片了😱,against
3646,eb5a9c58bc0a0467ea4874ec64566b016b166725,男,上海,其他,"如果我们想控制一个人，也可以用快速满足对方这个方法，因为贪图当下的享受是我们人类的本性。比如在消费主义兴盛的今天，很多商家就是用满足各位当下的感官快乐的营销方式来赚大钱。比如那些针对女性的奢侈品，化妆品的，再比如针对男性的网络游戏，数码产品，都是利用了快速满足人的当下欲望的商业产物。这些能令人上瘾的东西，都是马上能满足人快感的，快速满足完之后，就是极度的无聊和空虚，然后继续寻找新的类似的目标，充填自己内心的空虚，周而复始，反反复复。这是从商业营销角度来讲,利用人们贪慕当下的享受的特性来控制人的。",none
2662,9c04239378b2a51d7f4bfd626350f9186d984bd9,女,山东,中青年,官霉怎么不点评点评那些裸奔的，跳楼的，吃屎的，炸裤裆的？然后清朗一下电竞圈？英雄联盟这种网游就是精神鸦片，怎么官方还一直推？与我国社会主义核心价值观不符合，一个外国游戏，资本的游戏，用来控制我国青年思想的,against
1866,45e0c3bfa63201a1ace3a1db3dbe334badd750c3,女,北京,其他,如何更熟练卸载,none
1552,d28d99a8e0a57ef90627e785bf3c59862081ddb7,男,河南,其他,回复@MV三井寿:这个问题没什么可争得，每个人生活环境不同，可能你身边没有沉迷网游的小孩吧,none
1320,09dadf568d373f00a858bece36def1eaedc019e6,男,广东,其他,"你妈,真的活不下去了,也幸亏让我知道有钱家庭是怎么样的,我不和他们比我还是挺快乐的哈哈哈哈哈哈哈哈,安慰一下自己,钱真的好让人虚无缥缈,钱像精神鸦片也像致焦虑的毒",none
3043,660401730b4586fcf50977966c4cad773f4eedb8,男,海外,中青年,"韩国时隔十年废除青少年深夜玩网游禁令,2022年起执行：本世纪初期网络游戏开始蓬勃发展，由于担心青少年沉迷网游成为社会问题，韩国政府规定：未满,16,周岁的青少年于,0,时至早晨,6,时禁止玩网游,,,近年来手机游戏大量普及，青少年可以接触视频、动漫等多样娱乐方式，因此网游禁令是否有效引发了争议,,,韩国女性家族部表示，为预防青少年沉迷网游，将加强学校教育，并向监护人提供相关信息。",none
5042,73a261b1f1f30816cc1354ea12b311d2632fab81,男,河南,青年,“我们不需要知道电子游戏是什么，它会不会造成近视，它会不会上瘾，我们只需要一个背锅侠，一个可以掩盖家庭教育失败、学校教育失败、社会教育失败的东西，现在它叫游戏，十五年前它是早恋，三十年前它是偶像，三十五年前它是香港电影，四十年前它是武侠小说。,against
1702,d7c7bf2bd4c640e50bdf5ecb14c388f264657af9,男,重庆,中青年,游戏产业对相关利益方肯定危害性不大，对沉迷游戏的人侮辱性极强。,none
551,5f08c209bb9c972b925e799840f41136d14267bc,男,广东,青年,他们：女生只配玩换装游戏和服装搭配；也是他们：捏人和做幻化的时候想着怎么把自己的女角色搞得更适合冲“我女儿真好看”；省省吧。,none
1006,c992977e8aa4ed579dcce178cc14ad9f06422afb,男,上海,中青年,电子鸦片让我忘了悲伤嘻嘻嘻(♡˙︶˙♡),favor
3826,2821f3027da824792026c56c1fb6c66d533ee603,女,安徽,青年,真正想玩游戏的，再怎么防沉迷都没有的，现在身边喜欢打游戏的小朋友还是照样打，感觉对他们不会有影响哈哈哈,favor
5218,f0e265b88d4b696f67a55db8fee4b513f52348f3,男,浙江,中青年,这种央媒说的难听点就是狗仗人势，还想揣摩上意邀点功。教培禁令的影响还在，就尼玛又来逼逼叨叨，一方面喊着尊重市场经济，一方面又对市场拳打脚踢。这种媒体人有个屁的脑子，回家养猪吧。,against
5124,472c5a62d633e7987e1f844acd8a4dfaf6c97fdb,男,北京,其他,建议对游戏行业征收重税，但反对使用简单粗暴的禁止上市融资等手段，目的和手段都很重要，否则，容易好心办坏事。,none
1734,828af4908e6d791c062e333e37e764f4f80c5750,女,河南,其他,"社会,家庭,自身,孩子自己知道玩游戏不好，有很多孩子也会有担心。,担心的同时看到了家人，看到了社会人都是这样。,盲从，不从不行。为啥？我不要被孤立。,…………,孩子自己也难受",none
1582,b307a4ad5b3f2b1deaf587238d839ae69c2124e8,男,其他,其他,"精神鸦片建议朋友们考研坚持不住的时候看一集《民工》瞬间就会觉得不读书就是种罪过,死刑立即执行的那种,长沙·中南大学",none
5226,9ded975fb41f38c2587868c00a648cd5a94e14c3,男,广东,其他,应该限制18岁以下人注册账号，不过怎么说，对外要作为，对内不瞎折腾,none
2494,4984865523f3f6667e9405164b87d12a1a4cfe5e,男,北京,青年,以后国家间打仗就是炸对方发电站。断电即断网，断网就是元宇宙毁灭？炸毁东京热力发电公司，日本废宅一亿玉碎。,none
1464,a1c1a9e7387eea64315bcadc85b22736b12a02a5,男,北京,其他,",为啥王者荣耀小孩子容易沉迷不能自拔，上千人的开发团队，百十号产品经理心理学经理，精算师在那算，就好比你进了个微信满人群，499个拖就你一个散户千人千面更好解读了，1000人是吧，我给你建1000个群，每个群都499个拖。青少年心智没有构筑这种级别的防线的时候，就不应该被毫无保护的展示在这极度利用人性弱点的产品面前。限制时间有啥用，给你拉进499人的拖群，一小时和n小时区别大么。",favor
2683,45cf6a5beb855f8016d381fb9c3f64a544b462b6,女,河南,其他,这些可能就是那些平时躲在电脑后口吐芬芳的键盘侠，看看都是什么德行,none
240,09f93926d8e785b2419e77ad457f3d68e370baef,男,辽宁,其他,当代成年人，你只管享受福报和生孩子就好了嘛，玩什么游戏？你小时候它就是精神鸦片，你长大了，它就不是了吗？,favor
801,a663a5776c451bd9b4ec4573ad20be79c5f7929d,女,新疆,其他,［护眼是一个长期工程］需要每天、每月、每一年的坚持。爱父母爱孩子爱家人请为他们备一盒黄金视力眼贴，相信在这电子鸦片时代，你的眼睛一定会被温柔以待❤,none
719,6e8117133bcc5ec5b8564e3e32dc53b751240b2f,女,上海,其他,"出现了严重的b站戒断反应今天沉迷于小狮子和honest,trailer,差不多泡了1.5h,阶段性失败,（真的太喜欢小（da）🦁️（🐱）了,园长也是真心喜欢小（划去）动物,在现实的洪流中坚持自己的意志，这件事本身就很值得敬佩,希望世界和平，有生之年去泰加和童话～）",favor
2882,fd1d66283935e5ca501544a709a2f386f5cbd6d2,男,四川,其他,每天抱着手机刷抖音的人是怎么想的？？？？？？？？？？？除了吃饭，其他时间基本都抱着手机刷抖音，说实话抖音真的是现代社会的精神鸦片。用这些时间去学点儿其他的不好吗。,favor
188,fc2d4cf42497ac5e4796ce2b15aa58eac457c4ab,女,新疆,青年,蛮有价值的吧，今天上课在讲新闻话语权然后发了一个填空题：王者荣耀是什么答案五花八门，有农药，精神鸦片等等贬义词，最后公布正确答案是电子竞技当时我自己也在打王者（上课还是要好好听课），后来反思了一下，觉得好有意义，因为主流媒体给我们带来的刻板印象就是网络游戏都是垃圾，就算我自认为思想开放，但逃不过刻板印象。,against
1639,3231f11d2724bfd361b13e2e2fc857801cb016f4,男,安徽,中青年,清朝没有游戏机🎮也没有电视机📺。那些学生走向正途了嘛？哟呵，躲墙根底下斗蛐蛐呢？,against
251,8fbe21823dc9130cccc704a16b4e88c46bd9b426,女,其他,其他,"隔壁桌大爷跟投顾聊科赫,我心想大爷有点东西,接着大爷说一帮人沉迷精神鸦片打游戏,一帮人追娘pao,剩下没几个正常人,我：？这书是白看了",none
2525,31059c79e1dfab77739c5cb8138bbe55e79480ae,女,其他,其他,杀不死我的终将会使我半身残废！（。唉我其实在想，美丽新世界里的苏摩作为一种让人获得愉悦感的精神鸦片，在现实世界里对应的其实是不得不做的工作、内耗的行为方式以及天天早八的课程安排吧（……）虽然一个是幸福一个是痛苦，但殊途同归地让我乐/哀不思蜀，无暇顾及什么意义、审美和价值判断，虚假的幸福和真切的痛苦究竟哪个好我还不知道，但我的生活中连痛苦都是虚假的,favor
1381,64272018cce679be413c6d5aba28fa8563f0c4d7,女,四川,其他,我的天哪jazzclub简直精神鸦片了我喷手臂上吸一口就可以升天太好闻了吧而且一点都不会撞香还好没有买温暖壁炉，现在想想感觉太平淡了！！我永远爱margiela！！场外围观回春丹，明天还得运动运动才可以,none
5408,eb4d667ac34ddbe4fe94f7b8f44aa32b01494f7d,男,天津,中青年,你说这是14年数据的话我信14年我高中，大部分人都在DOTA1和LOL。我们十个人去网吧，3个人陪我DOTA2。30%一点问题没有,none
1629,c541ed402df1b87552ef284932f19ae5d37ab88b,女,河南,其他,有的人的微博对我来说真是精神鸦片，吸一口爽一小时,favor
1715,199ce3f887bd6af1df79c15a6915a1fe996073fd,男,江苏,其他,自控能力差的我，《连连看》和《祖玛》都能玩一夜！！！,favor
750,aefb1be6f3401d2fe439546bc492205b2fc80fc5,女,江西,其他,"day3:戒掉网络（操作起来才发现非常难，几乎像电子鸦片。碎片化时间不少，平时总是轻易拿去手机微博微信轮番刷。今天刻意减少刷手机时间，总觉得有点难受，可能还是太闲。晚上看组织二号头目的书《向上生长》，很有道理也符合我们的实际。目前读完第三章，这本书应该会读不止一遍。）day2:🍎,day1:不熬夜",favor
1543,b3eadab92f9a7f31e6ef55790de96502c8b09216,男,河南,青年,没有游戏的时候社会治安更糟糕,against
3715,854b57843c6a9a966979b148de789196b219fe2b,女,湖北,青年,"为了玩游戏，高中了每周末总还是同父母对着，像吸毒一样，不给手机不给电脑就疯狂叫喊，关在房子里不吃不喝，你够竟想干什么？,，不是说网络游戏有限制年龄上的吗，怎么一点都没有起到作用，照样能上，CNM",favor
1634,baf07abb533d087a586c4ced25246394017a777b,男,江西,中青年,"最主要的，是要定义什么是“精神鸦片”。如果这个词的概念都没有确定下来，说再多都是废话，都是鸡同鸭讲。而且我认为能说出,游戏是“精神鸦片”,这句话的人，也没考虑过什么是“精神鸦片”，他也不在乎，就是想游戏死罢了",against
2355,78f93f6118ff678efe3826189ac3280301fcf762,男,广东,其他,女生在公车上玩手机，身旁的大叔发飙：你的电磁波侵犯到我！！网页链接,none
2697,8c2af6b6d09d43d5b738a044efa82d4760d37b0e,男,其他,其他,表达问题的性质不一样，王者根本上是关于未成年人影响这个问题的，而英雄联盟是比赛国家方面这个原因的，两者侧重点不同，根本没有可聊性,none
2756,d594df9a3fa47e3586a4c4a24076fd56eed2a8eb,女,其他,其他,兔曲已成为我的精神鸦片，每当我加班时就吸两口，一点子元气入脑入心🥰,favor
400,d38bb33fcecd2e79f6c6dc62f65be29a823693ce,男,广东,其他,当今教师节送给老师最好的礼物是关停所有电子游戏，禁止开发电子游戏。这游戏危害不亚于当年鸦片呀！我们老师势单力薄地进行一场反游戏的“鸦片战争”！,favor
202,55adb878bf7def550cb10e5d524e59810a48c60b,女,福建,中青年,从来没有对男人热恋过，反而青春期对作品超级狂热，每天都很快乐，仿佛热恋一样,none
2130,5a864795cfc5461bbca1f7e9908bc597af5c4e4b,女,湖北,中青年,当手机绑架了我们的生活，我们都中了一种名叫电子鸦片的毒！,favor
1802,a906a3d35b9afa1ce7fb547d4a85bdfcdcd7e20b,女,其他,其他,电子游戏是不是精神鸦片难说，但我今年开始到现在倒是一直在猛吸电子鸦片意思就是不太喜欢这样的生活，更没有想到会开始惯性依赖社交媒体，更想不到自己居然会进入这种****的心理陷阱麻痹剂用的也不少，但是几乎完全没有正面影响的偏偏就这一次,favor
568,195921cd08bfe524ba76c685570432ca93805d3a,男,其他,其他,这几天清查罗云熙不着急，前几天说电子游戏是精神鸦片他可能比较着急。,none
1621,7622fc9146c3f7ceb23cdc96f092f17f6e84c593,男,上海,其他,",这个话题真的不能一概而论。应该这么说，有的电子游戏不是，有的则确实是精神鸦片。那些被称为精神鸦片的电子游戏，是游戏制作者故意利用一些人性的弱点，让人上瘾氪金乃至沉迷，他们的制作思路就是把人的精力和金钱全部套进去，跟杀猪盘没有什么区别，说他们是精神鸦片都是小瞧他们了。",none
