id,userid,sex,adress,age,text,stance
2182,0620fc9d38720e65be223f692919f810d86a9c2b,男,北京,中青年,我一直认为现在的很多机构倡导的教育方式，是造成孩子们心里越来越脆弱扭曲的根源。以前家家打孩子，也没见哪个孩子跳楼的，现在的孩子，老师说两句就能飞身而下，都是平时惯的。,none
3334,f940b10744c4fa63c9efc1574837a352ac9ac2be,男,广西,其他,回复@为有书香来:孩子没有自制力？你当全中国孩子都跟你一样废？,against
5212,435465a034585de3f9190f9be17679ce8d06b6e7,男,重庆,其他,没游戏是不是家长好管一些,none
978,9ab02182902bec91330c61ee779f6d4752fbb251,男,浙江,其他,游戏公司赚的黑心钱，坑坏了下一代。有些存粹是国外的公司，专门给中国青少年定制的电子鸦片。,favor
5273,a3c542a0e4dde9eb32093e3355201185b9872159,女,其他,其他,打tm有狗那年就说游戏是几把鸦片,against
3965,49d35e0f3f6cb565a0b0f48a376dd94f3d1c25d8,女,湖南,中青年,宁乡传授“独门秘籍”，为师生撑起“保护伞”！一直以来网上流传着一个段子平时在网络游戏中遇到“猪队友”都会隔着屏幕戏谑对方是小学生但是在咱们宁乡可不会这么认为而且为了让学生们学会更正确适度地使用网络宁乡将网络安全教育送进了校园教孩子们如何“安全上网”……图片图片图片为进一步提高师生的网络安全防范意识和自我防护能力，有效减少校园网络安全隐患，10月12日上午，国家网络安全宣传周宁乡活动走进宁乡市南雅蓝月谷学校，开展了一场别开生面的网络安全进校园宣讲活动。图片▲宁乡市委网信办、市教育局、市公安局参加。活动当天以“守护网络安全，构建和谐校园”为主题邀请长沙市网络安全人才库专家给师生讲授了一堂网络安全教育课▼图片讲座针对社会生活中的网络安全热点问题，结合网络诈骗、网络沉迷、网络谣言、黑客攻击等典型案例，利用网络链接、多媒体技术、影音视频等手段进行了剖析讲解，整个讲座内容通俗易懂、形式生动活泼，加深了师生对网络安全知识的理解，提高了师生自觉抵制网络和社会不良信息的自觉性，远离网络违法犯罪陷阱。图片▲学生聚精会神地听课。图片▲跟着授课专家一起朗诵网络安全防范口诀。▲课后，宁乡市委网信办、市教育局、市公安局现场发放了《信息和网络安全教育》阅读资料。当天下午宁乡市南雅蓝月谷学校分班进行了网络安全教育主题班会▼“今后一定注意专家今天传授的知识，正确、安全上网。”该校师生纷纷表示，将从自身做起，安全上网、文明上网，不沉迷于网络，让网络成为自己成长路上的好朋友。通过开展网络安全进校园活动师生进一步了解网络安全知识深刻认识到网络安全的重要意义有效提升了师生的网络安全防范意识据悉，近年来，宁乡市委网信办致力于网络安全知识的普及，通过开展网上趣味答题、开设网络安全展播专栏、制作网络安全宣传短视频等形式将这项工作常态化，呼吁社会各界和广大网民共建网络安全、共享网络文明。来源宁视界,none
5333,1d2e7a57696b6f5fdb21df54ec0abd5c02cf5d35,女,其他,青年,这样说真的不够准确，我认为一个如此有影响力的媒体发布如此言论难免有些不妥，毁掉未成年人的根本不是这背锅的电子游戏，而更多是缺少家长的高质量陪伴，我看到报中有提到一个孩子一天玩8个小时，这有些不尊重事实，现在王者荣耀等网游对未成年防沉迷是有很严格的管理的，非节假日1.5个小时根本玩不了几把，而所谓8个小时的游戏时间是根本无法杜绝的，未成年人完全可以利用各种途径冒充成年人得以长时间游戏，因此只需要加大全天巡航力度就行了，况且这样一个大的产业是已经成为了一个国家的重大税收来源，坦若缺了这么个大洞，敢说你这媒体能补全吗，这样无疑是给自己的国家断了后路。总的来说，称网络游戏是精神鸦片是不正当的，是可笑的，是未考虑周全的，一家如此有影响力的魅力发表如此言论，不禁让人所感遗憾,against
1411,5b2de0560f39a96654d5ed58c30aa5d43d0b0a4a,女,江苏,其他,算是吧，逃离现实生活的精神鸦片,favor
366,49316e3f2cbc95315c99ca8a226195609afaa258,女,海外,其他,"所以说游戏为什么能和这玩意儿对上，还nmd“电子鸦片”。//@卡了蛋儿kk://@-罐儿-:…//@青冥童子://@不喜杜康我萃香:,沾上就莫得救,//@霜叶:很难想象一条街能这么多……//@鋼筆様子:碰即死",against
2915,0a4d41cc1490090a5ec09b8a675a8e3382a9f626,男,广东,其他,有哪些早知道早好的人生建议？1..26岁之前不要结婚2.千万不要和不发朋友圈的女生谈恋爱3.除了“宝贝，你再忍一下”之外，不会再叫你宝贝的男人，趁早分手3.不要刷抖音，b站短视频，这些就是精神鸦片。废掉一个人的最好的方式，就是让他一天24小时刷手机。4.不要和最好的朋友合租，就像把最喜欢的歌曲设作闹铃一样，真的会很烦5.眼神阴厉的人绝对不要深交。6.和女朋友出去，一定要带伞！7.上面6条，总有一条值得你一个赞,favor
231,fb5c781b887249aa41bc274ebc289fc10a94f30c,女,北京,其他,快把未成年都禁了吧，一分钟也别给，看评论气笑了，游戏厂商无论怎么配合国家政策，都逃不过家长一句“精神鸦片”，反正完全抛弃未成年市场影响也不大，何必给自己找不痛快，谁知道未成年人抽烟喝酒，对这些真正的鸦片又贡献了多少呢？,against
1288,67e2a51495d10b18ad58350802019021a6e1d8c5,女,其他,中青年,我也不怎么喜欢打游戏,none
2969,bc60edf79eb621ed8b6546064aaabb0cdb06e623,女,北京,中青年,"11啥也没干就赶稿了,以前从来不敢同时看剧画画会分心,也不追剧,没有自制力怕有瘾,但这次7天不休太累需要精神鸦片,三部剧琅琊榜,终极笔记,棋魂,我可太庆幸看棋魂了…罪过,之后补漫！这个11很难忘,7天收获好多…到30集了…但好像残酷情节要来了…",favor
463,3958dfeb85f95d2dd5ae25429353c60a88abc3fa,男,河北,青年,基本上告别称作精神鸦片的电子游戏了闭眼后也是漫天璀璨,favor
389,dca13f0dfe2348777c850c7b97c0215499c9f72a,女,山东,中青年,"读书,读《向上生长-为什么“丧尸文化”越来越严重》有感“丧尸文化”是指受丧尸文化影响的人生活没有高级目标，只有基本需求，一时刺激一时爽，一直刺激一直爽。他们深陷电子鸦片，日夜沉浸其中。其实身上具备丧尸文化特质的人，大部分都是懒的缘故。今天的懒不仅是每天不想干活的那种懒，更是怕这怕那，今天怕大环境要崩溃，明天怕不确定性，而且生活过得很舒服，没有危机感。很多成事的人，都是一开始不小心接触到某些项目之后开始做的，没想到竟然慢慢做起来了。反而是计划好然后投入巨资开始要做的事，往往因为前期投入太大，没等盈利就把血流尽了。最好做低试错成本的事，要多做而且早做。丧尸文化就是现在对生活的安逸，当你没有了奋斗的目标，没有了前进的动力，那你就离丧尸文化进了一步。不管你现在处于何种地位，都应该始终保持着前进，不要停滞不前。不然不是你淘汰社会，而是社会淘汰了你。",favor
1378,c12a81ba7f508e090591c2cbe3a829f401f25aba,男,广东,其他,",游戏，是所有孩子的天性。今天的网络游戏，跟以往的打沙包、跳皮筋一样，有游戏规则、团队关系、创造性，能满足孩子最基本的心理需要、试错需要。",against
248,db9b7e5a0776d8172acb6547706950aca9c95f1e,女,山西,中青年,"记录：,1、大连涉嫌腐败（日本垃圾色情风情街毒害中国老百姓精神鸦片涉嫌毒害百姓们成东亚病夫重蹈覆辙被侵略被残害）案件",none
39,73924261beae050be2b50985ebf5139f68e8cdb4,男,黑龙江,青年,自我麻痹，闭门造车，精神鸦片，但推行这政策的那位要是不说好，不就下岗了,none
304,b0ac3258fc6e001419eff935c31f7d09de3db71f,男,河北,中青年,本来就是人的问题却怪游戏本身，现在的媒体故意引导舆论走向,against
2280,07ce91a24c8d17a338638fdb9e232bc5e07cd683,男,山西,其他,"电子游戏，对孩子就是一种精神鸦片@新华网,@人民视频,@财经网,@山西共青团,@太原校园,@山西省高校资讯,@大学新鲜事,,太原,老头子WJ9的微博视频",favor
2133,6f4ccf267156d283a41e502a8b9e2693f75ce972,男,福建,青年,"为什么家长那么讨厌电脑游戏呢？,电竞做为体育中的一种，可以锻炼人的脑力，可以培养团队意识，可以让人放松，何乐而不为？适度游戏益脑，过度游戏伤身，不能因为有沉迷游戏的青少年就一味禁止，双刃剑不只有坏的一面。只要能好好利用，就不是你们口中电子鸦片，而是能和足球篮球平起平坐的体育锻炼。",none
6,18b78a2870286462d335602a326a2c15c85f8a9c,男,山东,中青年,用脑子打游戏是电子竞技，不用脑子那就是精神鸦片。,none
297,782f3be7956bacd69cab53395062b39c3109f226,男,其他,其他,回复@果仁儿科技:对啊，把爱好发展成事业。又能生活又能体验其中快乐。,none
711,6e8117133bcc5ec5b8564e3e32dc53b751240b2f,女,上海,其他,"空瓶了,挺经用的,150ml早晚两次用了近一年,无功无过,降级了哈哈哈b站真是人间电子鸦片,立个flag,明天一天不开bilibili,（吸个狮子也能遇到sb饭圈那套,还要克里米亚离中国太远,少了很多熊孩子熊家长）",favor
1773,7a7bea85117dc3101a61089556d7a10551ae6ea6,女,其他,其他,本来因为这两天单位各种b事头特别疼结果！刚刚刷到了没见过的小黎照片真的有一瞬间头不痛了的轻松感嗑🍐还有治病功效果然网络世界是精神鸦片,favor
3327,9922ce0c1bc508c45ca74901ebf418f2606711c3,男,海南,其他,好像许多年前也有人这么说过武侠小说、电视？？这倒没见害一代人。倒是你这种没啥能力没啥作为屁事又多嘴巴还碎的人，在上一代好像叫红卫兵？,against
1355,3a359edb86489d212fa52cf1e84daf62fffac902,女,其他,其他,没自制力，玩什么都像是吸鸦片，不光是游戏，小说，短视频，漫画，玩具等等等等。所以应该反省的是家长，而不是怪游戏厂商,against
1511,73beb58a88ca0526e590fecf0906234173a16eee,男,其他,青年,哈哈哈哈哈真的要来了，和平精英先来:倡议未成年人12岁以下不准游戏12岁以上只能玩一个小时之前非节假日是1.5小时，节假日3小时，现在2小时用家长号玩的举报就能被封号并全天巡查未成年人冒充成年人游戏,none
2842,2a16b7f390c0abc33786ce75deff0337fb259cdd,女,辽宁,中青年,"可太喜欢我家猫了每天都要抱着吸,精神鸦片,抑制暴躁",none
5142,709c09d32b54d527b09c04d7e2d0cd1790bb3b6f,男,上海,其他,比起网游，小视频更像精神鸦片！,favor
224,6f2d1ea589995cccf6a03e99e9defcfc891f5a1f,男,其他,其他,所以教育为了不再失效，打击游戏,against
1485,fa9748586afc11a7443f08109415e00091e7147b,男,北京,青年,我的毕业论文写的就是游戏，游戏看个人吧，把游戏当做兴趣，并且适度是对自己有好处的。尤其是单机游戏，可以了解很多生活中的东西，但是沉迷游戏，你能怪游戏么？你不能，那怪你自己自制力不行。,none
104,53e687a97f9b42bd7a02281c3bed96f1da352637,女,海外,其他,短视频，成年人的精神鸦片，太有瘾了，一刷好几个小时停不下来,favor
4810,d68cc7d386f030295b54ee38ae2664710157a52d,男,湖南,其他,"发布了头条文章：《腾讯、网易，即将败给“第九艺术”！》,作为一种文化现象，游戏有正反两方面影响，甚至两极化的表述，在前八个艺术产品如电影、戏剧、诗歌、音乐中也不同程度的存在，只是游戏的覆盖面更加普罗大众化、泛年龄、泛阶层，才显得尤为突出罢了。,腾讯、网易，即将败给“第九艺术”！",none
3026,822ccff30510540a2614e0869d3a07b2d2065e1a,女,其他,其他,每日精神鸦片哈,none
813,f8ed849425a6b906a51967a960bb960468e47c8b,男,河北,其他,想想现在上网课的孩子多幸福，当年我们那叫电子鸦片，被抓到一通棍棒。唯一没有变得是一通棍棒。你为什么不上网课。,none
1725,3e9548cfe0fadb96839b2704efceed74f202aca3,女,安徽,中青年,基本都玩过哈哈哈哈,none
299,9f196d9269ab1f29518879250efaf58263b0b58c,男,湖北,中青年,太过于执着一件事就容易沉迷其中，无法自拔，玩剧本杀也不例外,none
3242,cadb6190814f5bd7ec8f6563be6d7fa9ce125659,男,陕西,中青年,游戏要禁止青少年时长，每天1小时。,none
533,000f9fae0da0e8ab07759f6a3a89347340d72889,男,内蒙古,其他,现在这个政策下来了。以后可不能找这个借口了。看看下一个“电子鸦片”是什么吧。,none
403,e048e4781369ccb33c416d4b7e60dec829f0706d,男,北京,中老年,王者荣耀游戏已经成为当代青少年的“电子鸦片”，强烈呼吁国家层面进行干预。建议相关部门全面整顿电子游戏行业，还青少一个生态环保的网络世界。,favor
5351,2306d631ffabae35430785b50ecdca2a42ce068a,男,广东,其他,",资本应该“取财有道“，不应该任性！网络游戏是精神毒药”，经济参考报发布关于网络游戏的新观点后，腾讯市值直接缩水4000+亿，可以肯定的是，这个报道的杀伤力堪称“核弹”！近十几年，网络游戏已经让年轻一代成为了“瘾君子”，体能下降，价值观扭曲，似乎没有网络游戏便活不下去的地步。网络游戏本质上是游戏，游戏的目的是益智、消遣，根本目的应该是解决谁会问题，而不是制造问题。关键的一点，资本不是没有国界的，不能胡作非为。你要发展网络游戏可以，但你必须考虑社会伦理、社会舆论以及负一定的社会责任，而不是一味的“金钱至上”！资本不应该成为“精神鸦片”的制造业，而应该生产“精神粮食”！希望游戏开发公司好好承担起社会责任，制定出奏效预防处理问题的措施，而不是暂时的“浮躁”！",favor
728,9f220af767a4f1f6a59e0009ffb540a10843a6c9,男,广东,其他,",正版不引进，引进又阉割。电影没有分级制度，游戏是“电子鸦片”。好作品不给上，各种抄袭无脑作品赚得盆满钵满。电影让🇰🇷拍了，游戏让🇯🇵做了，我们还剩什么？剩下996和007吗？",against
2306,baf17aa196d5305f141a5c59acaf0de493f376a9,男,山东,其他,"家庭教育并不是万能的，孩子沉迷网络的“锅”不能只让家长背，游戏企业在监管上负有不可推卸的责任。一些网络游戏在制作阶段就设计了令人成瘾的内容，一些网络平台在入口端就缺少鉴别，在这样无孔不入的状态之下，青少年沉迷网络就更容易了。@紫光阁,@健康中国,@共青团中央,@中国政府网,@山东发布",favor
2481,8fcdd05bf7a51694ccb6cb9ae9b6ddb02d0ff81f,男,北京,其他,"【#元宇宙是下一个精神鸦片吗#,？#如何看待元宇宙概念大火#,】现在的人们用科技创造一个平行宇宙，肉身留在现实世界，通过一副VR眼镜，让视觉和意识进入#虚拟世界#,。这就是元宇宙！元宇宙与古人相比，有两个进步。一是，人真的能够感知那虚拟世界，而不仅仅是想象；二是，可以在虚拟世界中创造和实现经济利益，甚至这虚拟的经济利益能与现实世界的真实货币相转化。说白了，#元宇宙#,就是用技术创造的一个虚拟世界，能让人真实感知的不超出人的想象能力的真实世界的镜像。能否达到这样一种境界？目前其本身还属于想象或初阶水平。#小慈面面观#,（上海新金融研究院副院长刘晓春）详情戳链接元宇宙：下一个精神鸦片？",none
2235,6c666bf6bc4917fa60d6ac3bc84d360cd5ca6960,女,其他,中青年,单机版天龙八部。其实后来仙轩幻三轨迹每个都震怒(尤其是不能随时存档的)，还琢磨给我删掉，我还悄咪咪隐藏文件夹震怒多了发现好像也没啥影响嘛，就这也配叫电子鸦片？从此就懒得管我了嘿嘿嘿[开学季][开学季][开学季],against
5119,cca188eec7e9b71544c91475ce71fad7d62e31c8,男,其他,其他,还政策要尊重市场，那大清朝怎么亡的！鸦片市场好，把国家给弄死了，某些资本家真是恶毒！,against
5380,7c43ef72513ed8f41d26c4b0bcb8fac5b4b0f8ed,男,吉林,其他,",现在是2021年，不是1991年，怎么还有这种弱智言论？？",against
1549,db6f543947f508441f902c56fc976afaf0d4e435,女,河南,中青年,"手机才是赤裸裸的精神鸦片吧，去哪儿都不能不带,不能不看，有时候实在不想带，因为工作或者别的原因，没办法,离不了",favor
301,9941351c37d4998d906d4a9afe1b19709a5aadd5,女,浙江,其他,少玩游戏不沉迷,none
5033,ffc40caa4297ff6bc0d08244ee8e715ab4a9139a,男,其他,其他,",电子游戏不是精神鸦片,但王一博是,借个位置，希望各位不追星的路人朋友，可以对我们伸出援手，8月5号（明天）是一博的生日，有积分的姐妹请大家帮忙投一下，让一博戴上小👑呀，谢谢大家",against
5047,0ffb5b494fff17aedccc135cf1e98e970466f309,女,山东,其他,说起游戏可以成为艺术品这一点，我个人认为《原神》真的品质非常好。长草期那段时间我最大的乐趣就是带着喜欢的角色，仙灵到我喜欢的场景去拍照，解锁观景点。放慢脚步，感受游戏的背景音乐。不同的地方有不同的特色。蒙德的西欧风格，璃月的古风，稻妻的和风都非常美且独特。,against
3133,84e49d46cb83ec62a5f8fac24d553426a297d938,男,广东,中青年,"先说大伙最关心的事，，咱们的,恒网ETF，，其实最近也是看元宇宙，网络游戏，云游戏，这些题材炒得很凶，，可是真正投大钱试水元宇宙的，其实是互联网巨头们，，",none
990,ca8552b47987d3b57be3ea185ea2b0730c66015b,男,其他,其他,不得不承认咱在游戏方面确实还是比国外略逊一筹，这并不是不爱国，而是很久之前限制“电子鸦片”等一系列举措导致了国内的畸形生态，而现在，控制不到言论的地方全部一刀切，可人家的作品国内确实拿不出能五五开的。看了看朝鲜...唉...,against
907,284806310fb99c25cc7285f5da143a4086c69d5b,男,海外,其他,100年以后的人还需要穿衣服洗澡刷牙么？100年以后的人是不是可以通过电刺激和化学物质注射来模拟任何感官了？是不是可以摆脱烟酒进入电子鸦片的时代了？是不是可以脑机互动了？是不是可以读取编辑记忆了？100年以后的人是不是可以对付热核战争了？是不是可以进行星际跃迁了？化石燃料用完了是不是又该工业革命了？有哪些职业可以在100年后得以留存？当我们活在一个物质世界极其丰富的世界，一切都不需要人力，每天混吃等死就可以，那时，是不是大家都一天24h沉浸在虚拟的游戏仓内，戴着头盔喝着营养液。我觉得或许不再需要老师？体力劳动者也慢慢淘汰？精英们将掌控社会的秩序？那些混吃等死的废物不再拥有生育权？家庭和血缘的概念将变得淡薄？孩子都去托儿所公共抚养？就像高中看的那本忘了名字的英文小说那样？我觉得罪犯这个职业应该不会灭绝，但是门槛应该不低。皮肉交易应该已经发展进入虚拟世界了。我很难想象100年后的商人跟现在会有什么区别，同样的还有警察或者政客，拿着激光枪穿着机甲执法？在虚拟世界制定更好的政策？头疼,none
5167,07c7e80c65a52e88314c3d7b741e1982abd9cab6,男,北京,其他,",游戏是精神鸦片？那么短视频是什么？",none
535,e9449c543134a8b46925a730b0f1997d59113b9f,男,北京,其他,"人与人的意志力本来就有偏差，对于低意志力的人来说，严格限制高引诱的电子鸦片介入，并无问题。,游戏这东西将就适度最好，劳逸结合。,但是总有人难以控制，总有资本家为了赚钱想尽办法吸引让你沉沦。大铁锤帮你严格卡住时间，我只觉得是个好事儿。",none
897,2e2a030bb69d9b4037b21d93b9b2f751fc4bedcc,女,浙江,中青年,不能依赖林则徐，只能靠自己,none
58,3e0e90f5c5142cd525dcc3c9e40d1daba6c4808a,男,广东,其他,国家为了青少年摆脱游戏的精神鸦片，特意出台了政策来倒逼腾讯等游戏公司做出一系列限制未成年人游戏时长的举措。结果一些家长倒好，为了省事，在孩子的威逼利诱下借账号给孩子玩。别再说什么就玩一小会儿，没什么影响的，这东西有一次就有无数次，最后深陷其中。到头来荒废了孩子的学业，别再来哔哔国家和游戏公司，自己的纵容才是孩子成长路上最大的绊脚石。你想让孩子成为什么样的人，就先做给他看，成为那样的人。,favor
200,261f68a554d25e145b014699ec7198d1cd72bba2,男,其他,其他,大家早上好，最近火爆的元宇宙概念明显和我国的战略不符合，现在脱虚向实，这个明显的沉浸在虚拟中，往大了说这个就是西方国家的精神鸦片！,favor
909,f5e1aee470a4449937a3eb53318ac0242a1d12e9,男,其他,其他,"［,这一档节目，其主要的目的在于纠正“电子游戏”是电子鸦片的思想。那么，电子竞技是什么？它是一场赛事，以电子游戏为基础，玩家们之间依靠计算机设备为载体，在虚拟的情景中进行的人与人之间的对抗，称之为电竞。它考验玩家们的心、眼、手的协调能力，使其不再是为了娱乐，而是为了争夺更高的荣誉，这即是那竞技二字的体现。我国的电子竞技它一直在蜿蜒曲折，不断探索前方的道路中成长，电竞，它也是体育运动，它也有着相互理解，友谊，团结和公平竞技的奥林匹克精神，也追求着更高，更快，更强的态度。电竞，不单单只是为了打游戏而已，它是汗与泪的交织，是比赛场上顽强坚持到最后一秒不放弃的执着，是感动与遗憾，是梦想转换为现实的枷锁，是带给你无数的感动也一直不愿意放弃，是选手们身披银甲，手拿白枪在最高的舞台上展露自己的一身武艺。电竞，它是荣誉！它是信仰！电子竞技在中国！",against
2321,b82207dbdce078f5285252fc7710cd6e02c51682,男,上海,中青年,"央视体育咖吧专题讨论：跻身亚运会,厉害了电子竞技！,体育咖吧：跻身亚运会,厉害了电子竞技",none
2819,9008ad660c6ab941f834591cd8786a4b11d64830,女,江苏,中青年,在操蛋的生活里寻觅精神鸦片,none
1433,3ab7b8c74850cd4eb9da6d8ad030eeb42da01828,女,广东,其他,讨厌抖音这个精神鸦片的原因之一就是真的会被吵到精神衰弱[苦涩],favor
2706,cb16d5a84ca33b1580123ce3f09f7d100e97bdad,男,其他,其他,"艹，我们学校也真的疯了，我不理解，宿管还打开门让他们出去，明天早上还有人考试呢。这才是精神鸦片吧,回想起你的微博视频",favor
5213,03bd26a1d049e8a9165ef514baac2d063a47a545,男,河南,其他,"确实,太溺爱了现在的孩子",none
3101,92bd7fbe61fbdd9661d7ffa0f3a9dfea4723fff5,女,陕西,中老年,腾讯游戏赚钱能力超强。,none
724,dddf6a596c80ed0d74fde96791653ea2b06ef898,男,北京,其他,",是，百弊而顶多一利。数量不成比例。毁掉的可能不止是一代人。,可以带着孩子多参加各种体育游戏，文化、艺术游戏。这都是正经有益身心发育的游戏。培养几个爱好，学一两种乐器，把他的时间占满，绝不能让孩子接触虚拟电子游戏这一块。这就是电子鸦片，电子DU品。",favor
5389,8888d7d08752250bc89076cf8890ca510f2dc26b,男,上海,青年,",“精神鸦片”难道不是短视频吗？",favor
118,fd16f5785f8b9f73a2d267bb8db012330c751b0f,男,新疆,其他,把这牛鬼蛇神也扫了吧，带偏国人价值观，毒害国人的精神鸦片，造就一批又一批懒汉！,favor
5188,0ad7d3fe10918d63c7d4a29443e0fc18b6529f9f,女,浙江,中青年,游戏股还能起来吗？,none
5344,a8324d560d9ca0c8052f66ae5f3e19347fa0a0d5,男,北京,其他,"股市,,一篇来自央媒发文，给网络游戏打上了“精神鸦片”的标签，也给今天的市场带来一记重击。截至港股收盘，腾讯控股下跌5.81%，心动公司下跌8.64%，网易下跌7.96%，哔哩哔哩下跌3.29%。众多公募因此受到影响。截至6月底，全市场76家基金公司旗下的506只基金重仓了腾讯控股，这些基金二季度末规模合计达到了1.64万亿。从持股数看，二季度末公募基金持有该股数高达1.98亿股，占其流通股比例的2.07%。超500只公募重仓腾讯：“精神鸦片”波及1.64万亿基金,张坤、谢治宇等旗下各有产品重仓",none
5279,b3d2ad8e2d7acc7ece89f9da59e329d7523e1e15,男,上海,其他,"据说打击网游的真正原因如图所示：,南京·国际赛马场",none
5104,88f1071edd400af69321713983fcd6b22ade8799,男,河南,青年,电子海洛因，精神鸦片，下一个是不是该虚拟大麻了？,none
