id,userid,sex,adress,age,text,stance
759,e3442ebe537dc7441b221e660c6fc1f66a8d22ed,男,吉林,其他,"游戏啊，爱你不是，不爱你又怪想念的。2012年伊始，我失去了太多，电子鸦片，今日起，坚决不碰！！！,金华",favor
2946,6d596c9a9d4bd0152aac4afce3fc6f030e821312,男,香港,其他,"原来说游戏是精神鸦片也没有错,鹰击长空chanleevi的微博视频",favor
880,fa428c19dd6e11bc37d77c5cc8e984fc7e4190c9,男,四川,中青年,"对待电子游戏的态度,（Videogames）中国家长认为的“电子垃圾”，“精神鸦片”。西方社会的看法又是怎么样的呢？,学英语的宝的微博视频",none
2629,171fb334cd57fe5d373ddbe2d8839585b91a7673,男,其他,其他,你去看看央视发的其他内容下面才几个评论，游戏却引来这么多评论，央视负责发这条信息的人应该就地免职,none
1524,48939b5e70aa0a886616c2eb3af5bc6a3d979d7c,男,吉林,中青年,你们是不是把毒品这东西想的太简单了？那东西成瘾性跟你们喝酒吸烟能比么？现在还拿来跟游戏比？,against
5420,cb1deabf32a50f2a92cb516ba432c683a9851473,男,北京,中青年,信息茧房，把人投喂的越来越嗨，弄的看短视频的人沉迷其中，个个跟抽了大烟一样兴奋。实在该刹刹车了。,favor
273,d915d8bbd603328dba80678c1ea9cd0862e545e5,男,上海,中青年,南山必胜客，鹅厂我党不相信治不了你。拿游戏祸害下一代，精神鸦片，希望青少年可以觉醒，自觉抵制。,favor
1318,c8ccd22cc51daf77152b4197424d7925153b9bcf,男,其他,中青年,",电子游戏不是洪水猛兽，本质上和成年人烟瘾、酒瘾、赌瘾、刷短视频等是一样的。之所以人们关注电子游戏更多一点，主要还是未成年人极易沉迷其中，严重影响了孩子们的正常学校和生活，甚至于破坏家庭和谐环境。其实每个时代的孩子，在成长过程会面对各种各样的诱惑，稍有不",none
4997,d00585d9eed9cf97b0ec6399ace0ae0dd3f540ed,女,其他,老年,"总感觉哪里不对，但又觉得说的很对。,反问，以上每次玩能占比一个人多长时间？",none
3847,1cb10cb217ce2da74330688c196e528e02e30986,女,辽宁,中青年,"如何防,连家长都不管自己孩子,怎么防？",none
3333,88005c0447b8c6a7ff5f0c9ab863367f3d6346a8,女,其他,青年,"自制力的问题罢了,别什么都是游戏的锅",against
1667,b603881ac54921a61e5de684e71205e1221b61c6,女,四川,其他,"《关于我非常开心看完综艺睡意袭来迟迟不睡然后emo玉玉起来这件事》①一时兴起听了首甜曲然后品味了自己苦涩的生活,回头来某透明液体已经汇聚打转了②某逃脱晋升为我的精神鸦片,目前像吃豆人一样必须连续看下去才能维持我日常生活了（）,可以预见未来的戒断反应很强烈③不该拖到现在不睡的④⚠早睡早起⚠",favor
1733,7cf3a3f31d7da5f20190b004f4f7d1d0123661f8,男,广东,其他,成长环境里父母也许人在心不在，注意力被手机，手上的事，工作的事占据，孩子分配到的关注质量，陪伴质量远远不够，为了忘记环境对自己的忽略，抛弃，逃入游戏世界，相比于操纵环境的挫败感，失控感，游戏提供了很好的补偿。,none
5343,39b36fa82e73bdad80ec7b01b72c0a8e0aab450a,男,湖北,其他,gww：还好剑三不是电竞,none
905,98aace9b73d0be34a54db29a2cc232d207a391af,男,广东,其他,"以后必须禁所有游戏，不然以后低头族越来越多，没心上班或上学的人越来越严重。精神病毒游戏等于电子鸦片，如有人觉得我说的不对，那就是你自己本身就有这个症状,，永远停不下来，身体健康越来越差，希望教育部门和管理网络游戏总平台可以24小时网络监控他们的手机用时情况，谢谢",favor
1252,3f32aae6daaa084a28a3d30b070f033c28a899b3,男,山东,其他,资本家是逐利的，没办法的事情。不过就算没有游戏也会有其他的代替品,none
2983,1b872e159ed17d4136aee56463947263c9fd1e78,女,北京,其他,欧盟被俄罗斯绑架了？德国人法国人重回不光彩角色?国际新闻对我这样的升斗小民就是精神鸦片，云里雾里就高大上了，真不如利用有限的脑容量多读书，自省留存,favor
5323,34f9047c37fd3815ebf4fb906b7d93aba6efed00,男,北京,其他,北京鑫根投资管理有限公司创始合伙人曾强称，资本不向善就会去投资房地产、煤，尤其是投资游戏的人就是祸害下一代的罪魁祸首，很多投的人最后身体都不太好。他还表示，目前中国最有价格的企业是茅台，但是肯定不是最有价值的。@老板联播,none
1539,41f3a96acac8e28e8f140bbb7dc0f44ec38dbf02,男,其他,其他,"玩游戏好歹人宅在家里相对安全,追星可是要追到床上去的",none
910,39c5f6bffd341a0da31663d61c8508d7956c1f71,女,广东,其他,"《电子竞技在中国》其最主要的目的无疑就是为了纠正“电子游戏”是“电子鸦片”的思想。,专访《电子竞技在中国》主创团队：纪录片的创作幕后",against
1372,27468c6b351d1ae2788a874c1efe8dcbdfccf382,男,浙江,其他,"网友求助：孩子不让他玩游戏就发脾气，该怎样治？,交通安全蜀黍的微博视频",none
309,8a5b6f0b651455eb7403912ae57a0e515bf0ae46,男,福建,其他,"挺希望限手机使用时间的，限制流量，社交软件,游戏软件每号每天限制一个小时,控制电子鸦片,明天开始放下手机拾起书籍📚",favor
2582,75567094678488a65a961a24d11c9a9d3da45795,女,广东,其他,作为不玩竞技类游戏也不看直播的游戏从业者，想说您看到的那部分，似乎不能代表游戏圈的全部。。。您无法理解的行为，我也很匪夷所思,none
901,a043a38561850448618a516265eac48c78abb827,男,其他,其他,"[玫瑰][玫瑰][玫瑰]手机是电子时代的精神鸦片既要享受精神的愉悦，又不伤害眼睛那就用保护眼睛吧！预防治疗眼病，改善治愈眼病值得一试别心疼那点..,！眼贴有价，眼睛无价！,沈阳·辽宁省汽车快速客运站",favor
1696,e71e2b21ba302d2237860997d331238abcc25520,男,辽宁,中青年,何必呢？这么梦回元年。下一个是男女授受不亲？还是恢复磕头下跪为礼？,against
191,f41d232b4318ba739c4e95520d7fbd9501ca4999,男,安徽,中老年,",近期，国家整顿网络游戏频频出“重招”，我相信是有效果的。这种被主流媒体称作“精神鸦片”，被笔者说成比鸦片危害性更大的玩意儿，必须实行分级限时限额管理。腾讯控股跌近3%，网易跌近6.8%，完美世界、三七互娱等股票开盘均跌超4%，感觉跌幅还是太小，相信还有继续下跌趋势而且还会继续大跌。港股腾讯开盘跌约3%，网易港股开盘跌超6%",favor
2910,3efd02196c97d4eac68f3ca59df5f0e3b71d07d8,男,其他,中老年,"“精神鸦片”侵蚀人类文明,该不该发起“网络销烟”,玄城子-议事厅的微博视频",none
898,285db0cb09271451d0d2ae66092c67f8aafbda2b,女,上海,其他,"到家时间倒推，5:00。佩服一些孩子，还是乐呵呵的。大家都蔫了，延误不是天气原因，但没什么争执，大伙人手一只电子屏幕鸦片，等。,深圳",favor
1442,03760cce09f3fdc8f402f004a4f9588784f37252,女,上海,其他,中国现今有两大祸害：一是网络游戏；二是网文小说。网络游戏祸害男的；而网文小说祸害女子。本质都是满足他们不切实际的幻想。男的要称霸世界，秒杀对手。这是男性所好女的要被捧在手心上，幻想白马王子爱她爱到为其生，为其死，没她活不下去。资本就靠搞这种精神鸦片来吸睛。不教人好，只教人做梦。慢慢你们就明白了。嫁给一个沉迷网游世界的男人，娶回那些爱做梦的女孩会是什么后果。日子是现实的。人可以不结婚但……人若以为可以靠婚姻过上不切实际的生活，那……只会害人害己。婚姻就意味着家庭负担。不想承担就独“善”己身，但……成了家还想不负责，只想索取，那只能两败俱伤。,favor
1178,c10423d92604242629712dbc8f21c4a9dfbabfe7,男,北京,中老年,"江南布衣是中国杭州的品牌——血腥阴暗的童装设计图案,,就是精神鸦片,,孩子是白纸,,注入了什么就洗脑成什么——衣服上的图案很隐晦,,大人不会细看,,但小孩子却对细微的东西感兴趣,,有探索世界的好奇心,,没有判断是非的能力,,是最好的洗脑对象，看管好我们的孩子们，魔鬼们已经开始明目张胆的下手了！江南X衣：国际阴谋集团伸向中国孩子的魔爪",favor
2600,7b9d2c955e91e1763e934da7c6cb7a4b2ec07c99,男,澳门,其他,央媒曾经把电竞打成“精神鸦片”，现在怎么了？EDG夺冠，央视转播，央媒也发声祝贺了。#英雄联盟夺冠#,none
673,17ce37388c2fe65a7b60901d43f778530593a90c,男,山东,其他,“哼！他们不仅说游戏算不上电子鸦片，反而说短视频才是电子鸦片！”一个所谓成熟的“大人”坐了下来，打开了他的短视频软件。,favor
2863,f8e148f711e460c56f9092203f50be7cb2d6602f,女,浙江,青年,我也好想玩,none
483,9fe121ab3a641c0c7ed3ba2cfa4d0c755d0530fa,女,其他,其他,"我怀疑是因为游戏产业太赚钱了,，体制不想让资本把钱都投到游戏上，所以不断打击游戏产业。",none
3299,f1995e435d9d44c26ecf1a8c9c1f7dbe8b6f6958,男,北京,中青年,"虽然Freemium这个词06年就被提出来，但直到当年中国的道具收费游戏全面发展之后，欧美才因为Social,Game的兴起真正开始重视。网赚在国内已经被玩滥了，最近因为区块链游戏的兴起，Play-to-Earn是否将是未来趋势又开始在欧美不断被讨论。其实Play-to-Earn从有网络游戏开始就存在，只要游戏中可以通过长时间的游戏行为，去获得某些特别重要的资源进行套利，外挂、工作室就会应运而生。那个年代许多人靠玩游戏赚学费，或是靠卖外挂赚进人生第一桶金的案例时有耳闻。而到了手游时代，玩法强调碎片化时间的利用，游戏多采用体力制或是副本次数，限制玩家的游戏时间，加上手游的外挂操作没有电脑容易，使得Play-to-Earn的风潮较PC网游减少许多。(虽然韩国游戏的外挂还是不少，但其他类型相对较少)而到了链游时代，Play-to-Earn的讨论又再次兴起，这次会有什么主要的不同呢?谈及Play-to-Earn以前，要先聊聊现在游戏较为主流的Play-to-Win机制；即通过玩家之间的竞争意识，刺激玩家的付费动力。这个机制的特性在于，有付费能力的玩家付费力会冲高，但没有付费力的玩家容易感受到挫败。因此，当一个游戏越强调PVP，通常付费爆发力越强，但游戏中的平均流失率也会越高；反过来说，以PVE为主的游戏，玩家的留存较高，但付费爆冲力较低，大多要靠广大的人数去支撑整个游戏中的付费体系。目前大厂的主流则是完全靠技巧，不提供数值道具的Play-To-Win，如大逃杀、Moba类的玩法，这种游戏不靠单一课长，更吃游戏人数总量，如果我们之前看Fortnite流出的文件，月付费ARPU大概是20~30美金，数字不高(一般强调竞争的手游则可以达到接近100美金)，其收入主要还是靠人数堆叠出来。一言以敝之，以上这些玩法，都是以Play-to-Win驱动了目前大部分游戏的玩家行为。而如果要聊现有的Play-to-Earn玩法，博弈也许是最好参照的游戏类型。有趣的是，其实大部分的玩家在博奕游戏中都赚不到钱，他们享受的是重大奖瞬间的快感。在这套循环中，游戏公司依靠几率设计，让九成用户所投入的资源成为经济体系中的动能。也就是说，输钱的人远大于中奖的人，投入在游戏体系中的钱，远大于产出给玩家的奖金，游戏公司能持续经营，玩家则满足了赌瘾。这套体系最大的关键，就是各种机台的几率设计，让用户感受到赚钱的可能性。所以，现有的Play-to-Earn并不能让所有玩家赚到钱，只有庄家(游戏公司)才是真正有利可图，这使得链游的Play-to-Earn充满了更美的想象空间。但是，当大家都赚到钱时，一定有人是付出钱的，如果不是现有玩家，也不是游戏公司，那就只能是新玩家。这也是为什么目前很多链游的进入，都需要入场费来构成经济循环。(譬如Axie,Infinity入场买宠物需要上千美元)也因此，我相信很多区块链游戏如果要能长久存活，现有游戏的Play-to-Win机制应该还是必须要考虑加入。但在手游中，Play-to-Win和Play-to-Earn这两个机制很少做融合。最大的原因在于这两件事情的动机是冲突的。打倒对手所要付出的代价通常就是金钱，如果玩游戏的目的也是为了赚钱，那玩家在游戏中的花费都会有所克制，否则就赚不到钱。比较理想的做法是，让游戏中的大户Play-to-Win,,而游戏中的中小无课玩家Play-to-Earn，大课可以购买中小无课所产出的资源。要形成这样有明确分工的体系，玩法上就必须要有工会如MMO或SLG，且无课“赚钱”的游戏行为不能影响到大课长的游戏乐趣，这套分工理论上才有办法持续下去。许多游戏就是因为无法处理因为赚钱衍生的外挂工作室，最终走向关服的结果。Play-to-Earn最大的隐忧(特性)，可能也就是这些利益所衍生出的玩家行为。当任何事情有明确利益时，就会产出各种“产业”或特殊的“集体游戏”行为。游戏中挖矿有利可图，就会有多开自动挖矿的外挂出现；限量NFT道具有明确的高价值且容易脱手时，就会有更厉害的骇客投入技术进行窃取。杀头的生意有人做，当游戏规则中存在巨大套利空间，就会有人尝试破坏规则。套利空间越大，尝试破坏规则的动能就越强。博弈游戏也常碰到玩家想办法破坏规则，找出几率bug的游戏行为，博弈团队没设好防弊措施，一夕之间跑路或解散的消息时有耳闻，这也是因为套利空间巨大所造成。但博弈的玩法至少单纯，产出的资源较为单一，当一个RPG游戏产出七八种资源，每个资源环环相扣，还能通过区块链机制进行变现时，可以想象只要一有套利漏洞产生，游戏的经济与玩法可能会瞬间崩塌，大量外挂与非正常玩法出现，最后赶跑Play-to-Win的玩家，使得游戏中没人可以提供经济循环的活水。这样听起来，两者融合起来的风险很大。但当区块链游戏绕开了Play-to-Win，只有单纯的Play-to-Earn玩法机制时，每个游戏在市场的竞争力就会变成跟股票一样，玩家对它的评价标准将会以月回报率、年回报率等数字为主，因此势必要加入Play-to-Win或Play-for-Fun的玩法以做出区隔。但这几种机制之间的融合与风险控制，可能是区块链游戏在未来能否成为主流最重要的关键。话说回来，博弈游戏倒是很适合跟区块链做结合，一方面这个产业对于风险控管已经炉火纯青，另一方面对赌徒来说，赚到的钱除了有更多的兑现管道，还能从虚拟货币涨跌的起伏中再一次享受博弈的快感。",none
740,c9fb5c1ed0351f51b182ef115813f58b27fbeb11,女,广东,其他,是不能说“精神鸦片”，就是“鸦片”,favor
534,42d7887b4eec48301b5c556f0b89ef054ad8263e,男,河南,其他,94年:“电子可卡因”00年:“电子海洛因”21年：“精神鸦片”“我们不需要知道电子游戏是什么，它会不会造成近视，它会不会上瘾，我们只需要一个背锅侠，一个可以掩盖家庭教育失败、学校教育失败、社会教育失败的东西，现在它叫游戏，十年前它是早恋，二十年前它是偶像，二十五年前它是香港电影，三十年前它是武侠小说”,against
1096,ef5ddf06d69c53a0b276f864a59e3a58c6001560,女,海外,其他,"我真的是年纪越大越喜欢看那些无脑甜宠文,看完了还不说,去找电视剧广播剧再看一遍,每天都被甜的死去活来,太解压了太快乐了,我的精神鸦片",favor
735,6aa291b373a90e35b14cf1a5d45c5df4c89fc590,男,其他,中青年,看起来的确有瘾！所以我把它卸载了！,favor
430,eb8db9d87b573ecaff85034fc92667477e9984aa,男,广东,青年,"需要你的时候游戏是电子竞技,不需要你的时候游戏是电子鸦片,介乎于鸦片与运动的诗意",none
5172,07dc74bd32846861ce103e398d22f71290dc8b71,男,云南,中青年,确实，希望黑悟空能顺利吧，给死气沉沉的中国游戏市场注入亿点活水,against
1643,298f946080cc521244e53af2b8a719ce6174dc70,男,广西,中青年,"说是精神鸦片的都是管不了孩子和没有自己的教育方法教育孩子的，还有偏远地区的人说的。说不是的都是有能力教育孩子的，或者家庭和睦自信的人说的。,是与不是官媒说了不算数。腾讯和阿里都是中国目前的两大经济。你能让国家出面把它给禁了？？？",against
5137,f75bb737327bb6c385a7d2f5ce1e7761db23e6eb,男,其他,其他,发展刚刚起色，又被一次打击。,none
157,41a86763556c26afc2c99fab577ef0286f38cbe8,女,江苏,其他,"哈哈md,又通宵了,小说这精神鸦片今年不会再碰",favor
2286,4a93c65644f55d695645ad46e60b8349346ceb97,女,陕西,其他,说点关于小孩玩游戏的事情。这次过年见亲友，初二和哥嫂吃饭，外甥今年二年级，在一个中上水平的民办小学。我老公立刻开始问“你们现在都玩什么游戏啊？”，我就感觉到我嫂子这边情绪波动。但我老公是个情绪隔绝体，他基本上感觉不到别人的情绪。游戏被视为大多数家长老师眼里的妖魔鬼怪，电子鸦片，我俩作为一个（曾经的）游戏行业从业者兼父母，那自然是有不一样的感受。小孩喜欢吃糖、玩儿游戏是天性，对抗天性自然不是容易的事情。万一操作不当，压制=报复性反弹。你现在压下去的可能会在青春期时候弹破天际。当然也有很多小孩本身就没有那么喜欢，比如我嗜糖如命，我老公就不爱吃甜的。玩游戏这件事儿上，爸爸一般比较宽容，甚至，这是他们养儿子最大的动力来源：带儿子打排位到求儿子带自己上分，“战友”——这乃是男人之间情感最强连结，战绩卓越，乃是人生最高之骄傲。而妈妈们最为焦虑的根源，是自己没有分辨游戏好坏的能力。其实游戏和动画都是娱乐，小孩没有自控力，放任自流都会上瘾，但动画的待遇就没有那么悲惨了，因为很容易鉴别，它还有很多正面的功效。其实如果有鉴别能力，游戏的正面作用大的多得多。早教平台就比较鸡贼，它们把筛选好的动画命名为“英语启蒙”，把筛选好的游戏称为“编程启蒙”，你就知道，其实信息的筛选过程本身是多么的值钱，直播带货的起飞、品牌的意义，进货商都是1688，但是你付出了时间和精力去筛选改进，并加上自己的印记（logo），无形中节省了客户在海量信息里的筛选成本。一部好电影也许能改变人生，但是电影是二维的，信息量有限。好游戏，你能体验无数种人生，一个烂游戏，也能让人掉进斯金纳箱里腐臭掉。比如那些自动寻路的页游，策划邪恶利用斯金纳和马斯洛的原理，对于毫无防备的人来说，都是工具人地狱。其实也没有那么难，可以翻一下《游戏设计的100个原理》，成瘾机制的鸡贼成份就无处躲藏。至于需要送到网瘾学校那种程度的孩子，那是长时期多重作用力毁灭一个人的过程，滚雪球的恶性循环，只要现实足够糟糕，总有一种方式逃离这个世界。,none
472,cbf548ab428920f10f3364c6317f0317e8846ab3,女,海外,青年,我还是不能理解电子鸦片的说法，一个是动都不能动的东西，一个是不可能没有人没接触过的东西，这两个怎么能同等类比,against
1540,2b0e5f4e49079d97797f883691c1bb17c7ba7f03,男,其他,其他,怪兽家长自己不会管孩子反而赖到手游上来了。当初就不应该让自己的孩子碰手机，也不想想是不是你们这些怪兽家长的问题,against
214,0ee6a1931d2565060b5578516eacbb94271d0d0f,女,其他,其他,"我妈看我生病太可怜,终于松口给我充了个腾讯视频会员脱口秀大会,我的精神鸦片",favor
1304,ec7bbdebe6ba048cb3f4c1cd389522224bedc290,男,河南,其他,实话实说，迪士尼和环球影城都是外国精神鸦片，其实是文化输入，对于我们来说，还是不要追捧的好，我至今没去过迪士尼。,favor
1363,93e6d67c747b7f454a7f19d48394b18cfa4886bb,女,山东,其他,"很怀念今年初罕贝贝狂贴cp的那段日子……很怀念……整个人浸泡在高纯度精神鸦片中欲仙欲死,……是多美好的日子。。。。",favor
3848,4d38ec46945aae5d69f511dbe2193c5ca8e9fef1,男,湖北,中青年,"这恶意评论的都是未成年的吧,成年人谁在乎",none
878,019cde7945567d44110df49f7cc55aa73bcef2a1,男,其他,中青年,"现在的人都在吸食电子鸦片，忘记书信中的往来。（我也不例外）谢谢。,永州",favor
1589,198898a4ee4fbce2dff863acfbaaa23d5c6f208d,男,陕西,其他,",是不是精神鸦片不评价，但是对于小学生长期沉迷游戏还是应该制止的，对眼睛不好、对脊椎不好、长期下来也会影响精神和食欲。最重要的一个因素是他们当你队友的话实在太坑了，所以一定要缩短他们玩游戏的时长",none
877,f15a6041543fc0457e38525bb295a5fe3a515836,男,山东,其他,莫让手游———“电子鸦片”毁掉青少年。医疗研究证明:9岁之前应让儿童远离“蓝屏”，以预防近视眼!30分钟内电子游戏可以减压。,favor
1707,bb07a2b1195664d9584377fc318010e0944179ff,男,江西,中青年,下一个短视频,favor
2619,273d4287998df94b79010aa9f74663b3baa404b1,男,浙江,中老年,电子竞技被列为亚运会了,none
1656,b2b17667cee6c0301bdb4fcc5e46f34514520b62,女,其他,其他,这都什么年代了还有这种论调？有孩子沉迷网络家长先反思一下自己有多少家长只要孩子一碰游戏就觉得哎呀不行了你这是网瘾一个心理健康的人会得网瘾？恕我直言，这个世界根本不存在可以让你心理健康的人得网瘾的游戏，没有这么好玩的游戏有问题去找心理咨询师，别整天怪这怪那🙃,against
23,8af7641151df2979570e26bd82490fc7e27d4505,男,天津,其他,"“你玩动物森友会吗？”“略略略略略略……”“我在动森里面穿JK~”“那些都是精神鸦片，我只喜欢王者荣yua！”“我以为动森就钓鱼盖房抓虫子了，后来知道满不这么回事儿，就我们班孙鹏成天把脑袋扎书箱里玩儿，后来摇杆儿漂移了她骑俩Joy-Con上学……你骑什么上学啊？”“干嘛啊你！”金广发宇宙动物森友会SWITCH,SW-7561-0530-3727",favor
1533,d28d99a8e0a57ef90627e785bf3c59862081ddb7,男,河南,其他,",是不是精神鸦片我不知道，但据我所知周围的小孩10个有9个都是玩网络游戏的，相信沉迷它的也绝不在少数。现在很多人把主要责任推到家长身上，我觉得这是极其不合理的。当绝大多数孩子都沉迷网络游戏时，第一个应该反思的是游戏厂商，其次才是家长……",favor
465,99b5c88185697ff50a4ac65ebd9c2982120c4c78,男,海外,其他,造成这种现象的原因，本质上是语文教育浮夸化风花雪月化导致的，古文教育尽量选辞藻华丽的风花雪月文，无限拔高唐宋诗词地位，忽视甚至完全无视理学文。刻意将古文和汉学哲学思想对立，将古文变成了纯粹意义上的绣花枕头仅供当代年轻人吹嘘和无病呻吟以及生搬硬凑型考据在电子游戏爽文小说等毒瘤鸦片里,favor
565,feaa36f41ab184e838bbb68c2e9cd1beeeec7487,男,浙江,其他,",今年以来发生了很多大事,各种明星爆雷被处理,相比多年前明星出事低调过完风头还能复出现在国家对失德艺人处罚真的是一撸到底,今年以来的共同富裕试点,双减政策,打击游戏电子鸦片等,都再向我们表明,社会正在从效率转向公平,而且步伐越来越大,台州·三门县",favor
5129,95410c8a5cdb8c027bab1b8f30d037c5a2b0443a,男,四川,其他,",新华社旗下经济参考报发布一篇题为《“精神鸦片”竟长成数千亿产业》的报道，游戏股应声下跌。网络游戏，你认为是精神鸦片吗？网络游戏，是不是精神鸦片？",none
2818,0d433bd7298a1023ab506a8badd5ebf1413e5529,女,其他,其他,耳机快成为我的精神鸦片了，逃离整个世界的好去处，上了大学后老佩服考研的人了，大家真的好不容易，高中生活真的好轻松了（甚至我的高三也很轻松,favor
