id,userid,sex,adress,age,text,stance
526,952f22e8d420e9ee207da683a9384dfb85a14bd6,男,山西,其他,是得好好控制下小孩子玩游戏了,none
5446,f6e6dc1c2578522688f8c58e4c364de1f176fcef,男,广东,其他,，腾讯跌超9%，网易跌超15%。目前该文章已删除。,none
5080,5d163753c3b8674313d11b041017d90352d57099,男,其他,其他,赛博大清1907仿生林则徐会消灭精神鸦片吗,none
5405,720d5e992f6911b54411d306a720e3439f8113ca,男,北京,中青年,回复@赵泽宇赵泽宇:是王者农药吗？,none
1912,3f07f8b79c4de484f21921945e8f0cb9e118cc2d,男,江苏,其他,电子游戏不是精神鸦片，但某部门坚持不分级而让没有自制力的儿童没有限制的接触电子游戏才是让电子游戏变成真正的精神鸦片。,against
511,1e3b51fcff5cc5dd30fdb07493771e4d6b85bf75,女,北京,其他,"这是没打过游戏的人写的吧,什么被动接受信息,填鸭式教育吗打游戏才要动脑呢好吗",against
779,7da4f38a9d57e310f79fb5017e52e1d801823816,男,辽宁,中青年,就这个网络游戏不知道为什么在中国就成十恶不赦了，国外的游戏产业和文化是那么的发达，怎么我肯的孩子玩游戏就成玩物丧志精神鸦片了？怎么我们跟外国人比差啥？,against
2451,bd82b1d5c5fcf13be44ea91c09af1625eccff67c,女,广东,青年,so别把他当成精神鸦片,none
1705,3680966877ff99397cabaf73e08652a7c5290fd0,男,上海,其他,欧游，世界上你找找教育成功的国家。,none
2907,b5e02e2e7978d9734b8c4e2a71853e2264df9325,女,山东,青年,抓紧卸载23,favor
541,6582d4b918410d2a32d38c134abf4c02e2bbf5c8,男,山东,中青年,教培，医疗，地产，游戏，电商....一开始都在看别人的热闹，迟早会轮到自己的行业的,none
2191,5d5b9f34737329a9a55896e547467f4404701102,女,广东,中老年,有个青少年模式设置一下就好啦,none
42,dee087605f0e6d7036c7f966cf17d724915c6df0,女,山东,青年,现在互联网就是我看美女的工具，一晚连看三小时美女睡意全无我直呼精神鸦片。我早上一睁眼就开始个个软件来回交换看漂亮女的，到太阳落山我钻进被窝还是要看漂亮女的，谢谢你，这个充满美女的互联网世界。（我勉强把自己算做其中之一（谁和我关系好，24h之内v我五块钱我把你也算进去,favor
3637,51d269ff0fa2d351c31a88ae27f8c016fae4edf6,女,湖北,其他,"芙清,面膜58,在孩子沉迷于某些行为的时候，很可能是因为潜意识里对现实的逃避。父母此时就应该帮助孩子意识到自己目前最重要的是什么。如案例所讲，网络游戏只是一种休闲，不能代替生活的全部。如果孩子还没有听进去，就要采取奖罚的方式解决问题。这些都有助于实现目的，并且还能变成孩子自己的内在要求，从而培养孩子的自控能力。",none
2465,46888300fa1b9166c1049efd58f24612eba47f56,女,辽宁,中青年,过分执着，精神鸦片，恐惧和屈服都使人不幸，只有面对才能成为更完整的人。感谢在我至暗时刻拉我一把的人，推我入深渊的人，当然还有尚存理智的自己，也许还有下一次，下下一次郁期，放手来吧，存在过的一切都参与对我的重塑，感恩！,favor
327,6b89d9e8c0df1ecfb6d069cd6496207e16243516,女,河北,其他,不能片面看待，网络游戏也是社会发展的产物，也是某个可发展的领域，一定要多加管控引导,against
2912,273792362a6ac79a74185024d15f6de994cb453f,男,其他,其他,"央媒批网游为“精神鸦片”，你以为只是游戏吗？其实在下一盘大棋,情商思维0815的微博视频",none
3998,4dcb2503b87ec87ca16295a837001fbdd7f7772a,女,山东,其他,dy本身下沉用户多也正常。还好dy算法会让我们流量池碰不到这些人，但也会因为某个爆火的视频看到一些匪夷所思的发言。我觉得挺有意思的，看看他们的视频，有的人是真的在热爱生活记录生活努力生活。以前很不屑于刷dy，觉得是精神鸦片，现在我彻底被这种不同的人间烟火气吸引。你看，在你难过的时候，一直都有人在努力活着。,favor
1708,d33b3db4d97bd7c6ec1153870350e74e6e9610f3,男,北京,其他,",篮天下,铁粉们，你有沉迷过打球/打电子游戏/打篮球电子游戏的经历吗？编编先爆料自己——的确在刚毕业的时候沉迷过一阵子2K11……至于真的打篮球的话，因为比较累所以没有沉迷过……",none
1476,d51e7118210d6d780dc42a420fb8349c1860871b,女,浙江,青年,太快乐了，追星真的太快乐了，许嵩现在就是我的精神鸦片我永远爱(馋)许嵩！！,favor
319,50dc126e7abe1689e21435f166400ff9e0547a07,女,海外,其他,"@小布小安777,俺承认收了白等1999的狗粮还不是因为俺离异单身带俩娃目前怀三胎中。都是俺老公不争气啊天天吸食游戏这种电子鸦片，俺要是有办法绝对不走这条路啊。俺答应你，还了这笔钱就金盆洗手不干嘞，您看您是每个月给我转200还是一次性付清嘞？",favor
598,792d4f86980647ade4a897d07e1b08b5bfd469ea,男,陕西,其他,电子鸦片是指什么,none
458,2be6e30084f3efe5a92a05c5d7e495f07b80a41c,女,海外,其他,"回复@眠总并没有什么特别想说的:不错,我还有电子下体（被抓走",none
1034,dd51cb85a2b4529841a736540e79a69dc58f1fdb,男,其他,其他,"看到一些农村孩子一天到晚打游戏，我心里是很难过的。希望有关部门把这些电子鸦片彻底杜绝了。这些孩子，小时候不好好读书，连个基本的代数几何都不会，长大了还能干什么？,除了房地产砌砖扎钢筋，还能怎么脱贫？",favor
5328,6dc280d454795fd806b9c1b458869b780e22a896,男,浙江,其他,说错了，或者说它说的太极端了。孩子教育难道就是网络游戏可以影响的吗？它这样的说法把其他教育主体的责任摘的就剩寥寥。,against
364,59b7af63c601d2e4f2689b48e84e90ca905413f8,男,其他,其他,最近在想这点无数次，感慨时光飞逝，却越长大越不知道如何形容这，如天凉好个秋，真真是天凉好个秋在这个娱乐至死的时代，我们感慨着娱乐至死，却经历着娱乐至死，因为娱乐而蹉跎时光，如同吸食着电子鸦片，从前不觉得，现在越来越能感受到过分充足的精神生活的弊处，与现实脱钩，沉迷于网络世界，而耽误现实生活，现实中有那么多有意义的事情值得我们青年人去做，而我们却又在做什么呢曾几何时，我是一个有雄心报复的人，好像还是我是一个想暴富的人，物质上的富有没有太大变化，精神上的富有却好像缺失了很多处在时代的洪流中，我们经历这信息大爆发，也迷失在各种各样的信息中从吴某凡事件中，从霍尊全网黑成那样又因实力而被惋惜，从抖音中的警官连麦网红致他们宣传交通知识防诈骗信息，还有之前看觉醒年代感慨那时青年人的血性方刚胸怀大志先烈的投身革命英勇无畏家国天下。我越来越感受到语文老师让我们写作文时表示的正能量才是社会主流趋势。我以前觉得，历史这种东西不是像我这样平凡的人能书写的，现在觉得我们每个人都处在历史的洪流中，我们所经历所感受的何尝不是时代的脉搏历史的车轮呢，我们每个人都可能为自己添下浓墨重彩的一笔……好了好了，忽然感慨这么长时间，我也得去完成自己的作业了最后愿己愿家人愿世界皆安！,favor
1231,7739051905aa88ec5f2550d02b764771f008fd9a,男,广东,中青年,",网游=精神鸦片？,做好这三点，再也不怕孩子沉迷网游！,孙明展的微博视频",none
213,8cf1c747fd48259fcad035b6c73bb419cef5efbf,女,四川,中青年,没有底线的部分企业严重影响了正在成长的一代人，说是精神鸦片毫不过分，希望国家加大整治力度，让黑心资本和无用娱乐远离国人。,favor
2953,1c15fe8ca7dc1e2f9c58e5551254ae8717f25223,男,其他,其他,日本风情街的意义，很多人都不明白其险恶用心！日本要征服中国完全是不可能的！只有白痴才会担心日本能征服中国。还记得鸦片战争吧？要征服中国，必须先弱其国民！让中国人没有理想，不思进取，沉溺于声色犬马，灯红酒绿之中！看看那些日本风情街吧！就是毒害中国人的精神鸦片！那些商人，见利忘义，不去考虑以后的后辈，被日本人算计，人不自强，其国必亡，历史上那么多国家都是这样灭亡的，那么多文明古国就是这样灭亡的！当然，人类已经发展到现在这个阶段，要用阴谋诡计去灭亡一个强大的文明古国，是很难很难的！,none
773,2b6488a05a3fbb20455437bf2268fc80aa804517,男,北京,其他,",阿里为啥不做游戏？马云说：残害青少年的事我做不出来！,短线刀客888的微博视频",none
3957,b6a0e99f5894a5fb23dd59f7bd1fc492b2d29a66,男,香港,其他,光靠企业当然不行，违法产业链要端掉，社会人员，包括家长、孩子、还有执法部门都要配合。一些家长一般叫着游戏祸害小孩，一边随手就把自己手机给了孩子玩游戏，国家再怎么管也管不了这种情况啊[攤手],none
358,a432828fad51f90c34499b7ce97763085481607b,男,其他,其他,不停地诅咒挖矿者的的恶心小鬼不比08年的香港人恶毒多了？08年的香港人可是婴儿奶粉被扫光也只是骂蝗虫，你们只是打个游戏打不了气急败坏成什么样了？,none
593,3530fea5b9923973d8718295a784599d04e15d96,女,香港,其他,"这几天忙着赶路，没怎么刷微博。发现虽然没跟上热点，但好像也没什么损失。以后准备少刷点微博，多吸点电子鸦片，嘶～哈～,海东",favor
5410,cbe3525c99850d8c4ad1d274d8605c65e1b66dd2,男,海南,其他,8月3日，经济参考报发表文章《“精神鸦片”竟长成数千亿产业》称，当前，我国62.5%的未成年网民经常在网上玩游戏；13.2%未成年手机游戏用户，在工作日玩手机游戏日均超过2小时。网络游戏的过度投入对我国未成年人生理和心理带来双重负面影响。2020年，我国超一半儿童青少年近视，因沉迷网络游戏而影响学业、引发性格异化的现象呈增长趋势。游戏危害越来越得到社会的共识，常常用“精神鸦片”“电子毒品”指代。,favor
406,414d3f7e3c63539e773b7dd0ad115c83b1080a00,男,北京,中青年,最近视力下降太厉害了，矫正视力已经是电脑放在正常距离都看不清常规字符的程度，需要放大才可以。结膜炎也一直没好，眼角总是痒痒的。高亮提醒自己：请关闭小红书！放下塞尔达！正常坐姿看电脑、看ipad、看电视、投屏玩游戏都ok！不要葛优躺吸电子鸦片！保护视力，正确用眼，健康工作五十年！,favor
5165,ea14ff4f3855a84b48528b3e7a9847a7bc6c5a32,男,其他,青年,",不光要关闭游戏，还要关闭学校。学校害的孩子们精神萎靡，成天吃不好睡不好，考试成绩和老师言论更是蛊惑人心，害的每个家长都拿成绩攀比，让孩子失去自信心、让孩子更加叛逆。学校就是社会上的精神鸦片！不断的残害祖国的花朵！按某些人的话来说：学校将对未成年人身心健康造成不可低估的伤害",against
1465,891dba0c8899fa5fabbc8fbadaa1325df8349e83,男,浙江,中青年,所有东西成瘾都是病，不只是游戏,none
607,285af3e17a89b7ec18bb7e1f4ce6ff57d3ae5b1a,女,广东,其他,是呀，爱好本来就是很主观的东西，大家都有各自擅长的领域，就像我爸从来不bb我一柜子“五颜六色的格子校服短裙”，我也不会bb他买长长短短的钓竿[苦涩]打游戏遇到无能狂怒的鲨匕，他攻击你的性别正是因为他认为这么做可以激怒你，但他没有想过电子竞技菜才是原罪,none
5364,4eb7e6920b4507e9f2dfd0cb9c3b7b7fedd22334,男,其他,其他,"一个东西老一辈的都爱玩，就叫“国粹”一个东西新一代的都爱玩，就叫“精神鸦片”笑话请尊重每一代人的爱好和精神,",against
357,a432828fad51f90c34499b7ce97763085481607b,男,其他,其他,一群吸电子鸦片的游戏玩家居然有脸嘲笑别人是浪费电,favor
5445,e20d58a0b3c8b748eb6d40470796ebefb6186d1a,男,北京,其他,其实担心不让补课了，孩子玩游戏的时间更多了......,none
1216,46026a7263afc14448ffeebd640c5f069859c0e1,女,四川,中青年,我爸就是除了上班睡觉都是手机，对于他们这种老年人来说，短视频才是真的精神鸦片,favor
5066,d7eef928171b02449ac5225ffa8e31d034acb28e,男,山东,其他,没人接盘上面有人急了。先搞教培，后搞网游，白酒，现在又是直播。左使一下坏右使一下坏，搞的股价大跌，说白了就是稀土和锂电池没人接盘，想把资本从其他板块里赶出来接盘。,none
497,99e3b6e8e3593ee062adfe0851f14e295d85ed5c,女,北京,其他,关于未成年游戏时长限制：做不好折中那极端点真的反而喷的人少游戏的光明未来不是某个游戏，而是人们放松时玩游戏不再会被说吸电子鸦片，玩游戏像看书跳舞一样成为被尊重的爱好短视频平台出了多少钱？,against
1083,930817f7f43e2f3599690584facafdad6717cdf1,男,其他,其他,之前的人们信仰宗教是因为人生太痛苦，宗教是人们的精神鸦片。今天如此多的人信仰宗教，不是因为他们的忠诚虔诚，而是这是他们的一种社交方式，因为人与人之间心的距离越来越远，人越来越无法走到别人的内心之中，去教堂做礼拜就跟农村人到村口聊天一样的目的。,none
393,38ef4536a3b604e83ed5a9163793359dac5eb691,男,海外,其他,六点了，打开好友界面六个人都在决斗，你们成年人先戒掉电子鸦片吧,favor
104,b0b35ff68ec62d790315926b5cbb2dddeb489343,女,其他,其他,和耽改有什么关系????一个人出了事是因为他演了什么剧？？？？大连坐连人连圈子连领域找点精神放松还他妈被叫电子鸦片审美也要由人家来规定敬逼死人的时代,against
5437,3002f5e5aad17a6785399c38e5d11789e07c5530,男,广东,其他,主要是腾讯没充值，所以就变精神ya片了,none
1760,19852d2a02cdf89d6381c644dfcd3a7402a0bdd7,女,四川,其他,运动完一边拉伸一边吸食精神鸦片,favor
3434,14ad55bff5ab053a79e1fdfdee7f477a31962e2c,男,河北,中青年,随手玩一下还可以,none
368,82e9fc3bb959c59fe2e6a19f511c07585fbc6ebd,男,其他,其他,和先定义为电子鸦片再强制1小时相比，这就是教科书,none
5201,e4c1d221dec2ebc69ebe9d434085e517889f951b,男,其他,其他,之前是海洛因现在是鸦片，说明网络游戏没有以前那么劲了,none
1019,90c2c35724b1899d8142cdb97d23cd4b5b3ec3dc,女,安徽,其他,无所事事的熬了个大夜，之前看到评论说：抖音可谓是新时代的电子鸦片。起初不以为然，觉得过于夸张了，现在看来电子鸦片真是名副其实，所以惯常没有自制力的我，决定卸载！！！因为要开始好好加班了！！！,favor
1630,23fd835190f2622e7816d4a7edf04ec54c7d3d4f,男,其他,其他,回复@ring199108:打游戏不能活动脑子？,against
3954,9605b355b661e83c6dd5779cd0d9eb41f7721d1b,男,北京,其他,"国家新闻出版署日前印发通知，要求所有网络游戏企业仅可在周五、周六、周日和法定节假日每日的20时至21时向未成年人提供1小时服务。然而，网上活跃着大量账号出租平台，未成年人花十几元租个账号，便可绕过平台审核无限时玩游戏。还有平台非但不核实买家是否成年，反而以“无防沉迷”为卖点诱惑未成年人下单。（北青-北京头条动画,翟长锋,后期,翟雷涛,配音,王雯雯）,青流视频的微博视频",none
5255,cfcad5077c20040c07f77d1639f34af1ef33e643,女,北京,中青年,",管管孩子，救救游戏。还有就是这个自我阉割的风气噢，今天经参一篇大稿——游戏是鸦片，好家伙领导直接来句未来都不要做和游戏相关的选题了，好的坏的都不行，属于敏感话题，不谈就对了。",none
306,7cb5a4bd50cbec511f8d20e12b55a6dbd32fc1bf,女,其他,其他,"就跟沉迷游戏是一个道理,适可而止",none
5048,d5c0831821b0e3adf782f37841b452b74b930be9,女,福建,其他,"真的！有时候特别羡慕那种比如喝冷饮,打游戏就能真的很快乐很满足的人！",none
3834,6948294653bbd80f94a91466ccefe814022857b2,男,福建,其他,据教育部网站，日前，教育部、中宣部、中央网信办、工信部、公安部、市场监管总局等部门联合印发《关于进一步加强预防中小学生沉迷网络游戏管理工作的通知》，部署各地做好预防中小学生沉迷网络游戏管理工作。据IT之家了解，通知要求，各地出版管理部门要严格执行网络游戏前置审批制度，督促网络游戏企业加大内容审核力度，坚决杜绝网络游戏中含有可能妨害中小学生身心健康的内容，确保内容优质健康干净。网络游戏企业要采取技术措施，避免中小学生接触不适宜的游戏或者游戏功能。要严格落实网络游戏用户账号实名注册和登录要求，将未成年人用户纳入统一的网络游戏防沉迷管理，不得在规定时间以外以任何形式向中小学生提供网络游戏服务。通知指出，学校要严格校内教育管理，做好中小学生手机管理和校内互联网上网服务设施保护工作。要加强网络素养宣传教育，广泛开展各类文体活动，引导中小学生正确认识、科学对待、合理使用网络，自觉远离不良网络诱惑。要推动家校协同发力，督促家长履行好监护责任，发挥好榜样作用，帮助孩子养成健康生活方式。通知强调，相关部门要切实加强对网络游戏企业的事中事后监管，及时处罚或关停违反相关规定的网络平台和产品，鼓励相关组织或个人，举报落实防沉迷措施不力的网络游戏企业和平台。同时，要将预防中小学生网络沉迷工作纳入教育督导范围，将督导结果作为评价地方教育工作和学校管理工作成效的重要内容。,none
1402,5ef452d8f1cf407eda52ea05b31a9d0fa7b42529,女,广东,中青年,(o´艸`)我要是有这身材就不用减肥了叭！在游戏公司工作这么多年，我觉得网络游戏只是这世界万千诱惑的其中之一，主要看孩子自制力，和家长怎么引导。有些说看动画片学坏，玩电脑学坏争取，玩手机学坏，与其怪这怪那的，不如正确引导。让孩子成年后也能理智对待其他诱惑,none
1688,d7e6d1ce51038f72eb6e132995ed124beca74ca4,男,北京,其他,这个问题分怎么看，对于一些人来说，电子游戏可以称之为“精神鸦片”；但对另外一些人说，它也可以是“精神食粮”。有的人玩游戏，可以说是一个职业，通过玩游戏可以扬名立万过上更好的生活，对于这样的肯定属于后类而不属于前类。但有一些人玩游戏，则是让整个人萎靡不振，弄不好还弄个倾家荡产，对于这样的你说不是精神鸦片是什么？所以说这还得分人，遇见一个“瘾君子”给他什么都得上瘾,none
738,e450dc2f6d0ddfb29c7548963b12b36005bb559e,女,上海,其他,书是电子鸦片的良药,none
1169,468c84d04a31fe3ea62825b23c7c04670c750e6e,女,其他,其他,很久不听歌了，久到把网易云卸载都对生活没什么影响了。为什么不听歌，我分析的原因有三，其一是我太容易沉浸在一种旁若无人的状态里了，但办公室的硬社交让我不得不与人去交流，其二是我喜欢的歌大都悲情且丧，像精神鸦片一样会让我爱上这种感觉，但职业不适合这种状态，其三是我听歌会入迷导致失眠，越听越精神，间接性导致变丑（熬夜让人变丑），想着卸载也好，重拾歌曲的契机就是最近糟心事太多了，觉得努力与回报从不是正比，梦告诉我运气也蛮重要，所以我又开始听歌，沉浸在另一个世界发发呆，暂离现实。太拧巴了不好，咱们都敞亮点。,favor
5294,f5f87626d33f42fbac5474192a5ddb261ba524e7,女,吉林,青年,父母和孩子多沟通多出去旅行还有多合作一起完成挑战的任务，比买玩具买礼物买皮肤来的更重要。,none
5204,3d1d70b5315e5b9a9ecffdebfa936b4e7af45f1f,男,其他,其他,什么时候到短视频啊？哦，原来写稿子的人都看短视频啊，那没事了。,none
70,f3bb05b882788302d0924e4e69dabfd2d17fe7fe,女,其他,其他,老爷们可能觉得游戏不是文化宣传一种手段,none
1777,6b8f2aa2a4cc1628af10eee9add87ff44b198ee6,女,其他,其他,你一直都是懂得趋利避害的聪明人，这种情况下你可以选择沉默明哲保身，但这种积极投诚的态度只让我狭隘得觉得你的智识也就这样了，你是心里就认可他们那一套。很多东西过去早有苗头，我是从来不懂得及时止损的，当时怎么会舍得放弃磕cp这种顶级精神鸦片呢。龚老师，一些叹号真的很没有存在的必要。,favor
1014,46ea96f46eb7dada249d0ddae6e4e508f7a90b11,男,广东,其他,刚刚在知乎热搜榜单上看到这条新闻，作为被王者荣耀毒害的我赶紧截个图发条动态。无论王者荣耀对他以及他的公司产生了多大的影响，总得来说王者荣耀就是个电子鸦片，对我来说就是害人的东西。,favor
603,285af3e17a89b7ec18bb7e1f4ce6ff57d3ae5b1a,女,广东,其他,核心玩家与非核心玩家又有什么高低优劣之分，你喜欢动森我喜欢战神我也没什么优越感，女玩家非得报菜名一样试图证明“女玩家不全是满脑子买包”属实没有必要，毕竟大部分女生根本不玩游戏也不在意核心不核心，娱乐对她们而言就是买包刷剧社交。买包刷剧也是爱好，你电子鸦片又比人家高尚多少。主机本就是小众圈子，甚至你身边的大部分男生也不会玩，每一天我都会在网上遇到无数同好，然而现实生活中除了同事，身边不会再有人同时拥有PS4与NS，对抽卡手游外的游戏如数家珍。其实只要别把自己看得太重要，就可以少去很多烦恼。,none
5169,09eadd0d9e4aeaa0eb514119e9957e5850155a33,女,广东,中青年,",什么良莠不齐的新闻工作者，官媒说话还是要付点责任的，寒了游戏行业人的心，企业哪里敢投入做精品3A游戏，文化输出又从何而来；我小时候打网游，长大了玩手游，身边巨多朋友也是这样也并不影响他们优秀啊，还精神鸦片，被毁了，正如知乎高赞回答汪惟说到点子上了，官媒的部门记者编辑，知识水平和政治觉悟还没跟上……",against
1297,c50bb9dfc6e5074d3d30637c3dfea592f95096f1,男,广西,其他,我们家的娃，从开始是听听音乐什么的，后来老人也觉得用手机带小孩比较方便，渐渐喜欢看手机，后来结果我们纠正，戒了很多，但是，总有种莫名的瘾。大闹的时候手机特别管用，总感觉是瘾积久了的爆发。我们是自觉不给孩子看手机，但是别人呢，出去聚餐出去玩，别人也带小孩的时候总让小孩看手机！这……,none
5412,cb1deabf32a50f2a92cb516ba432c683a9851473,男,北京,中青年,",短视频才是精神鸦片吧？从老人、到大人、到小孩，多少人沉迷其中。连幼儿都要嚷着看短视频，记者们难道看不到吗？快管一管短视频行业吧！",favor
1917,76f9e72baa414d0cc21e10c52b6e148c5db7396c,男,甘肃,其他,倒也不必又把这种说法翻出来。,none
5233,46d7c68b1ab4f7569c9993caa6b2e671c15646cd,男,湖南,青年,",希望老板们赚钱的时候考虑一下青少年吧",none
5175,9c80c6138bac8c15ad7250c26584661e92d83df9,女,北京,中青年,都2020年啦精神鸦片这个词还会用在电子游戏上,none
1716,906217babdcdd33d7095c032bcd8bd490e8ae93a,男,上海,其他,看到有人评论：一会儿精神鸦片，一会儿元宇宙，说不好的是央媒，说好的也是央媒。。。,none
721,eeaadaa22146abf68fa68f75c2972ccd964ac4b4,男,浙江,其他,要真说电子鸦片，按照接触频率来说应该是手机而不是电子游戏,favor
44,a36ca4599d9b13d425f041c066160c46a0b11b00,男,江苏,其他,电子游戏是第九艺术还是精神鸦片？最近一期的澎湃问吧播客邀请上海社科院助理研究员胡冯彬和复旦大学新闻学院在读博士任桐一起讨论了游戏的过去与未来，试图对游戏的本质到底是什么作出回答。讨论的问题主要有：游戏叙事和小说、电影有何不一样？游戏是“第九艺术”？游戏成瘾的根本原因是什么？,none
5439,8b438f6194e0b06396a95edc399f888923b95eec,男,其他,其他,运动一个接一个，是不是鸦片不重要了。永远拥护党中央！房子，车子，娱乐都凭票凭证发放。国强可期！hoh,none
2680,c0517ff9dc5bdc13de18dbe641f9a5a2bc4819d2,女,北京,其他,游戏本身又没问题,against
3138,f75a9b85c9db88233cb99f67c5322ffed92c4ac3,男,陕西,中青年,"目前我国的电子竞技运动还处于初级阶段，缺乏科学有效的管理，都没有统一的管理标准，对这一职业也没有正确的认识，从这个角度来说，如果不能做好普及科学管理，电子竞技很难有长久的发展，因为现在的网络游戏太危害青少年了,榆林·神木县",none
